Article Title,Abstract,Publication Year
银行业对外开放加剧了系统性金融风险吗——基于我国31个省级行政区数据,银行业对外开放能够引导商业银行与国际接轨，提升国际竞争力，但也可能引发系统性金融风险，对金融稳定造成不利影响。文章以我国31个省（自治区、直辖市）2008—2022年的面板数据为支撑，利用混合回归、个体和时间双固定效应模型分析了银行业对外开放对各省系统性金融风险的影响，就银行业对外开放下我国东、中、西部地区的系统性金融风险进行了异质性分析，检验金融监管在银行业对外开放影响我国系统性金融风险中的门槛效应后，得出银行业对外开放增加了我国系统性金融风险，且主要集中在东部，银行业对外开放对我国系统性金融风险的影响程度与金融监管的强弱密切相关的结论，据此提出银行业对外开放下防范系统性金融风险的建议。,2025.0
IP地理定位技术综述：理论、方法与应用创新,IP地理定位在推断网络空间实体位置方面具有关键作用，广泛应用于通信系统优化、金融风险防控和网络拓扑测绘等领域。针对近20年IP地理定位领域的研究论文进行系统总结，分析各类技术的特点、优势与局限性，并深入调研实际应用场景和潜在发展方向。通过构建综合性IP地理定位技术体系框架，整合不同方法与范式，重点分析目前存在的问题，旨在为后续研究提供理论与方法论的支持，推动IP地理定位技术进一步发展和创新性应用。,
商业银行数字化转型对风险溢出的影响研究——基于溢出指数测度和门槛回归的实证分析,在建设金融强国背景下，金融创新和金融改革不断深化，银行间关联程度不断提升，考察银行间风险溢出效应成为“守住不发生系统性金融风险底线”的关键环节。银行数字化转型提高了金融服务实体经济的质效，但也给金融风险防范带来了更多不确定因素。本文基于2013—2022年上市商业银行微观数据，利用DY溢出指数测度商业银行动态风险溢出，爬取百度搜索新闻文本数据构建商业银行数字化转型程度指标，研究商业银行数字化转型对风险溢出的非线性影响。研究发现，商业银行风险溢出水平较高，数字化转型程度对商业银行风险溢出存在显著的单门槛影响效应：在数字化转型初期会提高风险溢出，但在后期能抑制风险溢出。异质性分析发现，资产规模较大的银行数字化转型对风险溢出抑制作用更强，但资产规模较小的银行门槛值更低。政府应高度关注风险溢出水平较高的银行，针对银行数字化不同阶段采取差异化监管措施，推动规模较小银行加强数字化变革尽快跨越门槛。,2025.0
人工智能在金融风险预警模型中的应用与优化策略,随着金融市场的快速发展和日益复杂，风险预警的重要性越发凸显。人工智能技术在金融风险预警模型中得到了广泛应用，通过大数据分析、机器学习算法等手段挖掘数据价值，提高风险识别的精准度与效率。然而，目前仍存在数据质量参差不齐影响模型准确性，算法的可解释性差导致决策透明度低等不足。人工智能可以突破传统预警方法的局限，实现更及时、全面的风险监测与防控。本文分析人工智能在金融风险预警模型中的应用现状和存在的问题，进而探索优化策略，旨在帮助金融机构提升风险管理水平，增强金融体系的稳定性。,2025.0
基于人工智能技术的数学相关专业人才培养创新模式研究,<正>引言人工智能技术正引领人们进入一个数据驱动、算法主导的新时代，其影响广泛，涉及自动驾驶、智能医疗、金融风险评估以及语言翻译等领域。在这场变革中，数学作为核心基础科学，对人工智能算法设计、模型构建以及优化分析起着至关重要的作用。微积分、线性代数、概率论以及优化理论等数学知识为人工智能提供了坚实的理论支撑和工具，尤其在深度学习、机器学习等前沿领域，数学模型的构建和优化直接影响算法效率和准确性。,2025.0
基于人工智能的金融业务风险预警系统设计,随着金融业务的快速发展，风险管理的复杂性日益增加，传统的风险预警手段已难以满足现代金融市场的需求。研究旨在设计并实现一套智能风险预警系统，该系统包括用户注册登录、风险数据抓取、风险模型构建、实时追踪等功能模块。系统测试结果表明，该预警系统在功能完整性和性能稳定性方面均达到预期目标，显著提高了金融风险管理的效率。,2025.0
百年金融风险防范的中西比较,<正>西方金融风险治理的经验与局限 风险治理的制度框架：监管体系不断演进完善。西方自1825年首次爆发现代经济危机以来，逐步建立现代中央银行制度，曾在实践中尝试分业监管体系（如投资银行与商业银行分离）后回归综合式监管模式，试图通过技术手段（风险评估模型）与法律规范控制风险。尽管监管体系不断完善，但金融危机仍周期性爆发，表明单纯依赖市场调节与技术创新无法根除系统性风险。,2025.0
利率追逐机制与银行主动风险承担行为：渠道识别与机制检验,在利率市场化背景下，利率追逐机制与银行主动风险承担行为的密切关联，是决定货币政策执行效果的关键之一。本文采用我国上市商业银行的面板数据，基于渠道识别，通过设计多种两阶段回归模型，识别了我国货币政策风险承担渠道，并进行了机制检验，重点研究利率追逐机制与银行主动风险承担行为的关联性。研究发现：利率市场化背景下，考虑渠道识别后，实际利率越低于政策基准利率，银行追逐利率的激励越大，其主动风险承担也越高。这表明货币政策风险承担渠道显著存在。经过渠道识别、不同模型设定、采用工具变量法进行内生性处理之后，该结论仍然稳健。实际短期利率与平滑“泰勒规则”利率之差的主动风险承担效应占实际短期利率与标准“泰勒规则”利率之差的效应的85.24%～93.27%。“利率追逐机制”在我国占据主导地位，它具有滞后效应，若银行主动风险承担累积到一定程度，可能会导致系统性金融风险。本研究不仅丰富了货币政策风险承担渠道的相关文献，而且对利率市场化背景下疏通我国货币政策利率的传导机制，以及中国人民银行科学设定基准利率，防范系统性金融风险，也具有一定的参考价值。,2025.0
美国货币政策冲击对我国行业的溢出效应研究——基于生产网络的视角,全球金融一体化背景下，不断细分的全球化产业链分工体系引起金融风险在地域间的扩散。作为全球金融周期的主要驱动因素，美国货币政策冲击对全球金融市场产生明显的外溢效应。本文考察美国货币政策冲击下沪深A股上市企业中39个行业的股票市场表现，分析冲击对我国各行业的总体效应，并基于生产网络视角使用空间自回归模型将美国货币政策冲击的总体效应分解为直接效应和生产网络效应。研究发现：我国股市对美国货币政策冲击反应的40%以上来源于生产网络效应；不同行业在生产网络传导链条中的表现呈现异质性，这种异质性可以由行业参与国际生产网络的深度解释；微观层面，拥有美国子公司的中国企业一定程度上充当了美国货币政策冲击向国内传导的纽带。本研究为外部冲击的生产网络传导渠道提供了新的经验证据。,2025.0
促进还是抑制：数字金融对农村商业银行风险承担的影响,防范化解农村金融风险对推进我国金融高质量发展意义重大。数字金融的快速发展革新了传统银行的运营和管理模式，为农村金融机构提升风险管理水平提供了新思路。以2014—2022年我国79家农村商业银行为研究对象，通过构建面板回归模型，分析数字金融对农村商业银行风险承担的影响及作用机制。研究发现：数字金融对农村商业银行的风险承担具有显著的抑制作用，且这种影响在小规模农村商业银行和东部地区的农村商业银行中更为明显。机制分析表明：数字金融能够通过提高农村商业银行的创新能力和盈利能力来降低其风险承担。调节效应分析发现：宽松的货币政策强化了数字金融对农村商业银行风险承担的抑制效果。因此，在数字金融推动下，农村商业银行应持续加大数字技术的投入与使用力度，不断提升数字化水平，增强风险应对能力。,2025.0
中国金融治理能力现代化测度：发展趋势与空间特征,金融治理体系的改革和金融科技的飞速发展给金融治理带来新的风险和挑战。为科学准确地刻画中国金融治理能力现代化的发展现状，并为相关研究提供数据基础，文章基于2010—2022年我国31个省（自治区、直辖市）的面板数据，运用主成分分析法、核密度估计、Dagum基尼系数分解、莫兰指数等方法评估并分析了中国金融治理能力现代化水平、发展趋势与空间特征。研究发现：中国金融治理能力现代化整体呈现波动上升趋势，东部经济发达地区金融治理能力现代化水平最高；中国金融治理能力现代化水平总体上表现出空间集聚性和空间差异性，同时也展现了较强的地区收敛特征。基于研究结论，文章提出加快金融监管体系改革、区域协调发展、加强金融风险管理、促进金融机构创新和加强省际金融监管经验交流等建议。,
2025年《福建金融》选题要点,<正>根据中央经济工作会议及金融管理部门相关会议精神，结合当前经济金融的重点、难点和热点问题，2025年《福建金融》拟围绕以下重点选题组织稿件：一、金融高质量发展与服务实体经济（一）投资与消费再平衡的有效路径研究（二）做好金融“五篇大文章”与经济高质量发展（三）金融支持经济回归潜在增长率（四）金融高效助力促消费扩内需的路径（五）金融助推现代化产业体系建设（六）推动“科技—产业—金融”新循环的理论与实践（七）健全中国特色现代货币政策框架（八）货币政策传导效应与结构性货币政策工具创新（九）积极的财政政策与适度宽松的货币政策协同二、防范化解金融风险与金融稳定（一）探索拓展中央银行宏观审慎与金融稳定功能（二）经济金融领域的重大风险挑战与应对（三）支持股市稳定发展的货币政策工具的风险防范（四）金融支持房地产发展新模式,2025.0
高管持股变动对企业股价崩盘风险的影响研究,股价崩盘风险是资本市场的重大系统性金融风险之一，影响着企业发展和资本市场运转。本文以2007—2022年我国沪深两市A股上市公司为样本，考察高管持股变动对企业股价崩盘风险的影响。研究发现，高管增持和维持行为能够降低企业股价崩盘风险，并且这一作用在国有企业和高财务业绩企业中表现更为显著。在进行了包括增加控制变量回归、替换被解释变量衡量方式以及采用PSM倾向得分匹配法等的稳健性检验后，研究结论依然成立。本文的研究能够应用于上市公司治理实践，深化对高管行为特征和企业股价崩盘风险关系的理解，有助于实现企业高质量发展和资本市场良性运转。,2025.0
基于改进BERTopic模型的领域主题表征及演化研究,[目的/意义]瞄准领域前沿范围，预测未来发展研究主题，有助于科研工作者寻找该领域新的学科增长点，优化政府部门资源配置。[方法/过程]运用深度学习预训练模型增强文本的语义表示能力，提出改进BERTopic(SBERT-UMAP-HDBSCAN-TopMine)主题表征模型，以期丰富和完善主题表征与主题演化方法。首先，使用SBERT模型进行句子嵌入，弥补句子向量存在非光滑各向异性，UMAP降维后利用HDBSCAN算法进行主题聚类，为避免主题识别在语义表达上存在盲点，运用TopMine对聚类主题短语抽取进行主题表征；其次，利用WMD计算相邻时间段不同主题间相似度，发现不同时间段领域主题产生、发生和动态关联的过程，并对领域热点主题进行动态演化分析。[结果/结论]以供应链金融领域为例进行实证分析，将供应链金融的研究方向划分为供应链金融风险评估、供应链金融融资模式、现代金融科技赋能和可持续供应链金融4个类别，模型有助于提升供应链金融领域热点主题的可解释性与可识别性，通过动态演化分析发现可持续供应链金融是目前及未来关注的重点。,2025.0
区域系统性金融风险的度量及影响因素研究——以甘肃为例,随着中国金融业发展壮大，金融体系日趋复杂，金融风险的系统关联性日益增强，防范化解区域系统性金融风险愈发重要。文章利用TVP-VAR-DY溢出指数方法度量甘肃上市企业股价之间波动溢出的方向和强度，以企业之间股价的总溢出指数度量区域系统性金融风险，以各企业股价的承受溢出指数、传播溢出指数和净溢出指数度量其区域系统重要性，在此基础上运用逐步回归方法挖掘影响区域系统性金融风险的宏观经济因素，运用面板回归方法挖掘三种指数下影响企业区域系统重要性的微观因素。研究表明：甘肃区域系统性金融风险较大且动态变化，三种指数下不同企业的区域系统重要性具有差异。宏观层面，固定资产投资完成额累计增长率越高、工业生产者出厂价格指数越小、贷款市场报价利率越低，企业总溢出指数越大，越容易发生区域系统性金融风险。微观层面，企业的资产规模越大、总资产周转率越低，市盈率越高，其区域系统重要性越强。上述研究结论为防范区域系统性金融风险、助力企业平稳运行并增强企业影响力提供理论依据。,2025.0
大数据税收征管能否抑制企业过度金融化——基于“金税三期”的准自然实验,企业过度金融化最终会导致系统性金融风险。本文以2010年到2021的A股上市公司为研究对象。检验了大数据税收征管与企业过度金融化的关系。研究发现，大数据税收征管能够抑制企业过度金融化。同时，大数据税收征管能够通过降低融资约束、提高分析师关注度，来抑制企业过度金融化。进一步回归发现，民营企业、业绩上升企业、数字化转型水平高企业中，金融环境好、有银行关联、税收征管力度高的环境下，大数据税收征管更能够抑制企业过度金融化。,2025.0
房地产金融风险识别、成因及防范化解的研究综述,防范房地产金融风险是维持房地产市场稳定的关键，本文就房地产金融风险的测度方法、影响因素、宏观政策调控以及房地产市场波动对系统性金融风险影响路径的现有文献进行梳理。首先，本文梳理了房地产金融风险的测度，指出可以基于数据驱动、结构式与简约式以及机器学习模型，运用直接和间接测算手段对其进行衡量；其次，通过梳理房地产金融风险的影响因素，本文揭示了家庭、房地产企业、金融体系与风险管理工具四个层面因素对房地产金融风险的影响；再次，本文归纳了房地产市场波动如何蔓延至整个金融系统，发现其会通过信贷、股价与经济杠杆渠道对系统性金融风险产生影响；最后，关于政府对房地产金融风险的宏观调控，本文总结发现财政政策、货币政策与宏观审慎政策的有效结合能提升调控效果。如何有效识别和防范化解房地产金融风险仍将是我国新时期的重要任务。,2025.0
公司融资风险的高位演化——异质性管理者短视的新解释,投资偏差是融资风险的底层来源，显性投资水平因易观测而受到广泛研究，隐性投资结构因难察觉而鲜有关注。从公司投资结构上的时间和空间短视行为视角出发，探究其对债务和股权融资风险的异质性影响。选取A股上市公司2009—2020年数据为研究样本，通过线性回归及一系列稳健性检验发现，时间短视增加债务融资风险但降低股权融资风险；相反，空间短视行为不仅抑制了企业的财务困境风险，还加大了企业的股价崩盘风险。对于时间短视，市场竞争放大了其对债务融资风险的正向作用，但削弱了其对股价融资风险的负向作用。对于空间短视，市场竞争放大了其对债务融资风险的负向作用而对股权融资风险未产生影响。最后，管理者短视主要通过影响盈余水平与盈余波动影响公司的融资风险。研究结论为制定宏观金融风险管控措施提供了微观证据。,2025.0
时间序列异常检测综述,异常检测作为数据科学领域的关键任务之一，旨在识别显著偏离常规模式的数据点，在风险控制、故障预警和健康监测等应用中具有重要意义。本论文对时间序列异常检测进行了全面概括，分析了其面临的主要挑战和方法，复杂性主要来自数据特性、算法需求和应用场景三方面，包括数据分布的漂移、高维数据处理、噪声影响、实时性和泛化性等问题。我们将时间序列中的异常划分为三类：点异常、片段异常和变量间关联异常，并详细描述了各类异常的定义和检测方法。系统地回顾了基于传统统计、机器学习和深度学习的异常检测技术，分析了各类方法的优缺点及其适用性。统计方法在数据分布明确时表现良好，而机器学习和深度学习方法则在处理复杂数据时具备更强的适应性和能力，尤其是自编码器、卷积神经网络、循环神经网络、Transformer和基于图的方法等深度学习技术，在高维、非线性数据的处理中展现出显著优势，成为研究热点。此外，本文整理了SWAT、SMD、WADI等常用数据集，并说明了这些数据集在异常检测中的应用场景和特点。最后，总结了当前异常检测技术的发展现状，并展望了未来的研究趋势，强调提高模型的自适应性、泛化能力和可解释性是主要方向，研究将继续致力于多变量和多模态数据的整合，以及提升实时性和在线学习能力，以实现更高效和智能的异常检测，为金融风险控制、工业故障预警和健康监测等关键领域提供支持。,
绿色金融对商业银行系统性风险溢出效应测度,"绿色金融市场的发展对实现“双碳”目标和推动经济高质量发展具有重要意义，但其同样也会引发系统性金融风险。选择绿色金融指数和商业银行股票日收益率数据，利用分位数回归的CoVaR方法测度绿色金融市场发生风险时对各个银行以及不同类型银行体系的系统性风险溢出效应。结果表明：绿色金融市场对各个商业银行的系统性风险溢出效应为正且范围主要集中在11%～15%,绿色金融市场对不同商业银行体系的系统性风险溢出效应存在显著差异性，其中区域性银行表现较为敏感。因此商业银行要不断提高绿色金融的风险管理与预警能力，推动绿色金融的数字化转型；相关部门要不断完善绿色金融相关政策和体系，建立绿色金融风险防范机制，加强对商业银行绿色金融风险监督，防范系统性金融风险的发生。",2025.0
内外部冲击下的新兴市场国家宏观经济波动*——基于金融开放的视角,错综复杂的世界经济环境为我国经济带来严峻的外部挑战，金融业的开放使得外部冲击更易传导至国内金融经济体系。在此背景下，研究外部冲击对宏观经济波动的影响，对增强我国经济韧性、推进金融开放具有重要现实意义。本文采用带有外生变量的面板条件同质性向量自回归（PCHVARX）模型，探究金融开放不同阶段新兴市场经济体宏观经济波动的内外部影响因素及机制。结果表明：外部冲击中全球需求冲击占主导，且金融开放度越高，影响越强。内部冲击是经济波动的主要原因，随着时间的推移及金融开放的推进，外部冲击相对重要性增加。异质性分析显示，正常时期金融开放有助于缓解国内金融市场风险，而在全球重大事件发生时，金融开放会强化内部金融风险，增强外部冲击影响；低贸易依赖度和高制度质量水平的经济体受外部冲击较小，金融开放发挥了重要调节作用。因此，为增强抵御外部冲击能力、提高宏观经济韧性，我国需要畅通国内大循环、降低外需依赖，在深化金融制度型开放的同时防控金融风险，为经济内循环创造稳定安全的金融环境。,2025.0
地方政府债务与系统性金融风险的影响机制及政策选择,文章着重从房地产市场角度展开分析，旨在探讨地方政府债务扩张和系统性金融风险之间的关系。文章基于2013—2023年中国31个省份的面板数据，将商品房销售额作为被解释变量，将地方政府债务支出占地区生产总值的比重作为核心解释变量，通过回归模型分析地方政府债务对房地产市场风险的影响及其传导路径。实证结果表明，地方政府债务扩张通过土地财政传导机制，显著放大了房地产市场风险，进而引发系统性金融风险。与以往以理论研究为主的文献不同，文章采用实证分析方法，揭示了地方政府债务扩张、房地产市场风险与系统性金融风险之间的内在联系，为相关理论研究和政策制定提供了新的实证支持与研究视角。,2024.0
企业失信与债券违约预警——基于极值回归模型,在推动社会信用体系高质量发展的过程中，信用信息成为金融风险管理中不可或缺的一环。本文基于极值理论的回归分析方法，利用中国A股上市企业财务数据以及企业失信被执行人记录，探索企业失信行为与债券违约之间的相关性，并分析了失信记录在不同产权属性下的调节作用。实证结果表明，负面信用记录对企业债券违约具有预警功能，并且高频失信会导致企业债券违约的可能性不断上升。,2024.0
开放型经济下系统性金融风险监测体系优化分析,建立灵敏的、前瞻的系统性金融风险监测体系，是牢牢守住不发生系统性风险底线的重要前提。本文将大宗商品价格指数、实际有效汇率指数引入市场不稳定性风险指标，将银行流动性指标引入市场流动性风险指标，构建了四个维度的系统性金融风险指标体系；在此基础上，利用主成分分析法计算系统性金融风险监测指数，并采用长短期记忆神经网络等深度学习方法检验系统性金融风险监测指数的灵敏性和前瞻性。研究得出以下结论：纳入大宗商品价格指数、实际有效汇率指数、银行流动性指标的系统性金融风险监测指数具有更灵敏、更前瞻的风险监测能力；在长短期神经网络模型下，系统性金融风险监测指数的预测值与真实值在整体上表现出变动的一致性；系统性金融风险监测指数对银行风险加权资产比例、不良贷款率、拨备覆盖率等风险指标能提前1周至1季度进行风险预警。本文结论为进一步优化系统性金融风险监测体系提供了一定的参考。,2024.0
地产政策的转向逻辑、难点及未来展望,<正>地产政策调整的内在逻辑在于防风险自2017年党的十九大确立“房住不炒”基调以来，伴随政策逐步推进，我国“房住不炒”已经取得阶段性成果，经济结构转型也推动房地产在我国国民经济中的占比回归合理水平，但房地产市场价格、成交量、新开工面积、地产投资等多项指标当前暂未企稳，近年来下行加速，导致三大地产风险不断积聚：一是房地产属于高杠杆行业，地产增速下行后房企偿债风险向金融机构传导，滋生金融风险；二是通过财富效应弱化居民消费，拖累经济增长；三是通过产业链传导带动上下游产业同步放缓。,2024.0
