Article Title,Abstract,Publication Year
监管新规下金融机构PPP业务发展探析,"为规范PPP项目融资和中央企业PPP业务,引导PPP市场健康可持续发展,2017年11月,财政部和国资委先后发布规范性文件,对PPP市场提出监管新要求。PPP监管新规明确了PPP项目库入库及清理标准以提升项目质量,并加强了中央企业PPP业务风险管控。监管新规实施后,PPP市场呈现出以下发展趋势:第一,总体规模增速放缓,市场发展从重速度转向重质量;第二,政府付费类项目减少,使用者付费类项目增多;第三,PPP市场社会资本重新洗牌,回归民营资本与政府合作本源;第四,社会资本退出期限延长,对项目收益提出更高要求。在监管新规实施背景下,金融机构要优化PPP项目筛选机制,注重项目投资价值;拓展PPP业务范围,提升服务实体经济的水平;加强PPP项目风险管控,增强金融可持续服务能力。",2018.0
农信社转型提质应“坚守五个定位”,"<正>在科技金融与金融业务合流大势下,同业竞争将进一步打破地域、技术限制,农信社固有的亲缘、地缘、人缘等优势也将被逐步撼动。为此,农信社应全面贯彻落实党的十九大精神、全国金融工作会议精神和习近平总书记系列重要讲话精神,坚守""五大定位"",在服务实体经济、防控金融风险、深化金融改革上全面抓好落实。一、坚守深耕传统主业的战略定位。近年来,国有商业银行、邮储银行强势回归农村金融阵地,对农信社实施差异化战略造成了",2018.0
综述金融风险度量Expectile回归方法,"Expectile(期望分位数)回归方法是金融风险度量研究中一类非常重要的方法,它平行于分位数回归方法,有着独特的优越性。这里主要对期望分位数回归方法进行阐述,重点论述其在金融市场风险度量中的应用研究进展。",2018.0
我国系统性金融风险指数的度量与监测,"国际金融危机以来,系统性金融风险的研究已经成为各国政府和学者关注的重要问题,系统性金融风险不仅会对一国的宏观经济稳定产生重要影响,更可能带来国家福利和社会财富的损失。党的十九大报告中明确提出,要健全金融监管体系,守住不发生系统性金融风险的底线。有鉴于此,本文从宏观层面选取了包含宏观经济、货币流动性、外部市场、资产泡沫四个层面的指标体系并运用主成分分析方法构建了分层面和我国宏观总体的系统性风险指数,以此来度量我国金融系统的总体风险水平,并给出了风险形成的原因。研究结果表明,2010年以来我国系统性金融风险一直呈现上升的趋势,目前已经达到较高水平。本文的研究结论对于监测和防范我国系统性金融风险,促进金融体系持续健康发展具有政策启示。",2018.0
基于Twin-SVM的多分形金融市场风险的智能预警研究,"本文以沪深300指数(CSI300)长达11年的5分钟高频交易数据为研究样本,首先提出一种基于多分形特征的金融市场正常状态与关注状态的界定方法,并引入新型的支持向量机(SVM)人工智能模型,即孪生SVM(Twin-SVM)模型对多分形特征下的金融市场风险展开预警研究。实证结果表明:(1)我国新兴金融市场的价格波动具有显著的多分形特征;(2)基于多分形特征参数界定的正常与关注状态不仅准确,而且也具有明显的统计检验意义和明确的现实意义;(3)与传统SVM和BP神经网络(NN)相比,Twin-SVM不仅在预测精度上显著更高,而且在预测稳定性上也明显更优,即Twin-SVM能够有效地解决其他预警模型存在的非对称样本问题。",2018.0
回归本源 强化保障——关于保险业服务实体经济的若干思考,"<正>实体经济是国家强盛的重要支柱,是强国之本、富民之基,更是保险业存立的根基。第五次全国金融工作会议明确,""金融是实体经济的血脉,为实体经济服务是金融的天职,是金融的宗旨,也是防范金融风险的根本举措"",把""紧紧围绕服务实体经济""作为金融业的三大任务之一。党的十九大强调,要""深化金融体制改革,增强金融服务实体经济能力""。上海是改革开放的排头兵",2018.0
习近平金融思想的核心要义,"党的十八大以来,习近平高度重视金融工作,就做好我国金融工作作出了一系列重要论述,这主要体现在如下六个方面:关于金融工作的重要性,指出金融是国家重要的核心竞争力,金融安全是国家安全的重要组成部分,金融制度是经济社会发展中重要的基础性制度;关于金融与实体经济的关系,强调金融是实体经济的血脉,为实体经济服务是金融的天职和宗旨,必须引导金融回归服务实体经济的本源;关于防止发生系统性金融风险,强调防止发生系统性金融风险是金融工作的永恒主题,要把主动防范化解系统性金融风险放在更加重要的位置;关于建立现代金融监管框架,要求加快建立符合现代金融特点、统筹协调监管、有力有效的现代金融监管框架;关于完善全球经济金融治理,倡议发起成立金砖国家开发银行和外汇储备库,筹建亚投行,为改善全球经济治理、构建人类命运共同体提供支持;关于加强党对金融工作的领导,要求坚持党中央对金融工作集中统一领导,完善党领导金融工作的体制机制。",2018.0
新规视角下P2P网贷监管研究,"近年来,独具本土特色的P2P网贷行业在中国迅猛发展,但同时问题频现,凸显了在金融创新与监管之间寻求平衡关系的重要性。2016年8月24日,银监会等正式发布《网络借贷信息中介机构业务活动管理暂行办法》,引入一系列重要的监管举措,特别是将P2P网贷平台严格界定为信息中介,施加""小额分散""的投资限制,并制定信息披露和风险提示要求,在防控金融风险的同时要求其回归普惠金融的本质。虽然《暂行办法》借鉴了英美国家严格监管的思路,但在P2P网贷的商业模式、监管路径、信息披露要求和监管机构设置等方面仍需结合中国国情进行持续完善。",2018.0
跨越关口 打好三大攻坚战,"<正>党的十九大报告鲜明指出,要坚决打好防范化解重大风险、精准脱贫、污染防治的攻坚战。《政府工作报告》把""打好跨越关口的三大攻坚战""作为2018年我省重点工作,谋篇布局,精心部署。三大攻坚战,场场是硬仗,如何打好打赢?出席会议的省人大代表建言献策。防微杜渐,金融要回归本源服务实体经济防范化解重大风险,被列为三大攻坚战之首。它犹如""底板"",""底板""不牢,经济社会发展这个""木桶""再深、再大,装进去的水",2018.0
利率市场化进程中我国影子银行规模与房地产行业稳定,"本文基于2012年1月<sup>2</sup>016年11月相关月度数据,利用结构向量自回归SVAR模型实证考察了利率市场化对影子银行发展和房地产市场的作用效果以及利率市场化进程中影子银行规模与房价波动的动态关系。实证检验结果表明:利率市场化、影子银行规模、房价波动三者间存在长期协整关系;一方面,利率市场化进程会推动影子银行规模进一步扩张,使得金融市场面临的金融风险和经营风险增加,另一方面,随着利率市场化的深入,市场化利率在金融资源配置中发挥着积极作用,房地产泡沫化程度有所降低;影子银行规模的扩张使得房地产企业获得更多的资金支持,从而推动房价上涨,加深房地产行业的泡沫化程度。因此,当局在推进利率市场化进程的同时,应合理利用影子银行资金,加强影子银行风险管理,保障房地产业的健康稳定发展。",2018.0
黄奇帆炮轰外储后再谈金融:我说说这四个风险,"<正>讲回归本源,金融的本源,我在四五年前的金融工作会议上提出来的,对金融的发展要围绕实体经济服务中发展,特别要对金融的风险,去杠杆、防风险,避免系统性的风险发生。今天这个会议上我特别想讲的是四个方面金融的风险。第一个,宏观杠杆,国民经济的整体杠杆过高,我们国家政府的杠杆比是GDP的46%,居民部门44%,加在一起是90%,我们企业杠杆率有160%,怎么去杠杆。第二个,我们金融机构本身怎么在加强监管中去杠杆。不管是哪",2018.0
马克思主义关于金融风险的思想及其最新发展,"从当前我国金融风险状况的客观现实出发,运用马克思主义关于金融风险的思想,拓展分析当代中国的金融风险及其防范的问题,既为化解和防范风险提供理论指导,也可以进一步推进马克思主义关于防范金融风险的思想的发展与创新。须从国家安全的政治高度来重视金融风险防范问题,进而及时采取有效措施化解和防范金融体系内部、地方政府债务等重点领域风险,引导金融回归本源,坚持金融服务实体经济的本质,强化和健全金融监管体系,致力于为""两个一百年""奋斗目标的实现创造一个安全的金融环境。",2018.0
住房供给侧改革路径研究,"随着经济的突飞猛进,房地产作为国民经济的命脉,也避免不了高热的状态,令我国各大城市普遍出现房价收入比过高、结构性供求失衡的现象。本文基于房价理性回归的视角,分析房价理性与非理性增长的原因,阐述房价过高将会影响人力资本、诱发金融风险等危害,应进一步在供给侧发力,重点在财税改革、住房结构等方面发力。",2018.0
商业银行同业业务逻辑与演进,"本文从民国时银行发展同业业务化解金融风险的历史出发,梳理了现代商业银行同业业务发展的逻辑以及同业乱象的特征。认为银行同业通过""加杠杆""""加错配(久期)""""降信用""等风险扩张的手段突破监管规定,额外增加盈利的行为像吸食鸦片,一旦染上就有点难戒。在严监管趋势下,商业银行同业业务应回归支持实体经济的初心。",2018.0
新时代中小银行的普惠金融化,"<正>中小银行回归本源、化繁为简、全面专注于普惠金融,实现普惠金融化,这既是其对服务实体经济、防控金融风险、深化金融改革""三位一体""金融工作任务最为直接具体的贯彻落实,也是新时代化解我国金融结构与发展中不平衡不充分难题的有效行动。新时代下中小银行既有扩张模式不复存在以城市商业银行、农村商业银行为主体的中小银行近年来资产规模一直保持在年均增长20%<sup>3</sup>0%的速度,远高于年",2018.0
基于粒子群协同优化算法的供应链金融信用风险评价模型,"针对供应链金融模式下信用风险评价精度受信用特征子集与模型参数影响的问题,提出一种粒子群协同优化信用风险评价模型.该模型在充分论证供应链金融风险特征指标体系的基础上,利用二进制粒子群算法优选特征子集,并对支持向量机(SVM)参数协同优化.对供应链金融信用风险评估进行实验,并与传统径向基支持向量机和主成分分析特征抽取方法对比,结果表明,该模型优选的特征子集和SVM参数能显著提高信用风险评价精度.",2018.0
回归金融本质:互联网金融创新与“e租宝”案,"互联网金融创新是""双创""的重要领域,""e租宝""案例表明:互联网金融平台爆发式增长的同时积累了各类风险。互联网金融创新应回归金融本质,应用市场链理论可将互联网金融风险模块化为管理与技术的内控风险、超高利息承诺信用风险、低资产客户评估风险、监管生态风险、原始资本薄弱风险和模块间信息传递风险六个模块。互联网技术只是解决金融业务信息不对称的手段,应从金融本质视角出发结构化地防范互联网金融风险。",2018.0
P2P网络借贷平台模式异化及去担保化问题研究,"P2P网络借贷平台原本应该是单纯地提供借贷双方信息的中介机构,而在我国,P2P网络借贷平台模式发生了异化,演变为既提供信息支持又提供信用支持的复合型中介机构。P2P网络借贷平台模式异化的实质在于平台定位与风险控制手段的异化。目前,大多数P2P网络借贷平台引入担保机制作为风险控制手段,然而担保机制在事实上并不能很好地进行风险防范,相反可能造成风险的集聚,因此,P2P网络借贷业去担保化成为必然要求。去担保化意味着P2P网络借贷平台不再错位地担当信用中介,而是回归信息中介的定位;意味着P2P网络借贷平台要建立和完善风险控制体系以降低金融风险而非转移金融风险。具体来看,在推进P2P网络借贷平台去担保化过程中,一方面要采取建立健全强制信息披露机制、完善第三方资金存管制度等方式,积极推动平台回归信息中介定位;另一方面要在网络借贷融资中引入责任保险机制,完善风险准备金制度,强化平台风险防控体系建设。",2018.0
2017年广西保险业回顾与2018年工作思路,"2017年,广西保险业发展总体稳中有进,回归本源提高风险保障能力、防控金融风险、服务实体经济、服务国家和广西壮族自治区重大战略、保障和改善民生各项工作稳步推进,切实做到保险业姓保,不断满足新时代人民对美好生活的需要。",2018.0
关于金融去杠杆与商业银行去风险的策略研究,"2016年,供给侧改革的""三去一降一补""五大任务取得了明显进展,供需错配矛盾得到一定缓解,但当前经济增长形势仍不容乐观,改革任务依旧艰巨。数据显示,2016年初我国金融机构负债同比增速已经超过30%,成为资产价格膨胀的重要推手,同时非金融企业债务占GDP比重增至166%,与2010年相比增加了42个百分点。有鉴于此,去年中央四提抑制资产泡沫,充分显示出宏观政策的关注重点已逐步转向防范金融风险、抑制资产泡沫。2017年上半年,金融去杠杆政策频出,然而在有效收缩金融泡沫的同时,也对市场造成了一定恐慌情绪,或将产生金融监管引起的""二次风险""。因而有必要推进商业银行盈利方式转型,建立轻资本、重服务的新型发展方式;回归服务实体本质,严把自身风险管控;妥善处置问题资产,以市场化方式推进杠杆转移;改善资产负债结构,提升管理精细化;善用主动负债工具,积极探索资本补充渠道。从而确保在推进供给侧改革、化解资产泡沫问题的同时,实现监管调控与市场发展的适度平衡。",2018.0
银行需抓好五个“强化”,"<正>党的十九大报告是全党全国人民在新时代开启新征程、续写新篇章的政治宣言和行动指南。作为全国性股份制商业银行,民生银行贯彻落实党的十九大精神,要在做好服务实体经济、加快改革创新、防控金融风险的基础上,坚守特色战略,运用金融科技,发展普惠金融,同时全面加强民生银行党的建设。金融回归本源,强化服务实体经济党的十九大指出,建设现代化经济体系,必须把发展经济的着力点放在实体经济上,深化供给侧结构性改革,同时紧扣",2018.0
2017十大新闻,"<正>回望过去一年,全国金融工作会议召开、""金融委""成立、""双支柱""调控框架构建、金融回归本源……我国金融砥砺前行,为经济社会发展畅通血脉。回望过去一年,我国金融业紧紧围绕服务实体经济、防控金融风险、深化金融改革三项任务,锐意进取,稳中求进,成效明显。回望过去一年,国际金融业也大事连连,引人注目。",2018.0
“三大任务”齐头并进——2017年第8期封面回眸,"<正>作为中国最高规格的金融工作会议,习近平总书记在全国金融工作会议上提出的金融工作""三大任务""——服务实体经济、防控金融风险、深化金融改革,以及""四项基本原则""——回归本源、优化结构、强化监管、市场导向,为中国金融的发展改革指明了方向。",2018.0
遵循方向 回归本源 全面提升金融服务实体经济水平,"实体经济是金融的根基,金融是实体经济的血脉。为实体经济服务是金融的天职和宗旨,也是防范金融风险、确保金融自身持续健康发展的根本举措。习近平总书记在全国金融工作会议上的重要讲话,阐明了经济发展新常态下金融工作的指导思想和重要原则,对当前和今后一个时期金融工作做出全面部署,为我们做好今后一个时期各项金融工作指明了方向,提供了遵循。贯彻落实好这次会议精神的一项主要任务,就是要让金融回归本源,服从服务于经济社会发展,把更好服务实体经济作为金融工作的出发点和落脚点。",2018.0
企业商业信用规模与商业信用风险研究,"近年来,我国商业信用的规模快速增长,企业应收账款不断增加,占企业的总资产比例越来越高,应收账款违约风险也越来越大,因此在防止金融机构发生系统性金融风险的同时,也需要警惕企业间商业信用风险。本文基于中证指数上市公司半年度财务报表附注应收账款数据,研究我国上市公司应收账款规模和风险的规律,从宏观的视角对中证指数上市公司应收账款的规模和风险进行宏观数据回归分析。",2018.0
保理:蓄势待发,"<正>保理在经历了一个粗放发展的时代后,2018年将作为一个高质量发展的开局元年,进入一个新的历史时代。2017年是十三五规划执行的第二年,总体经济指导思想是""稳中求进"",稳通货膨胀、稳外汇、稳房价、稳实体经济、稳金融风险,逐渐在L型底部尝试稳步向上走。在这样的宏观经济政策背景下,回顾2017年中国保理行业,可以总结为""回归实体、稳中求进""。",2018.0
重新认识三大关系提升金融服务实体经济的质效,"<正>2018年是贯彻党的十九大精神的开局之年,是改革开放40周年,是决胜全面建成小康社会、实施""十三五""规划承上启下的关键一年。十九大报告明确指出,经过长期努力,中国特色社会主义进入了新时代,这是我国发展新的历史方位。在十九大之前召开的全国金融工作会议,明确了金融工作回归本源、服务实体经济,防控系统性金融风险、推动金融改革创新三大任务,为金融业的发展指明了正确的方向。",2018.0
线上供应链金融信用风险评估实证研究——基于C-SMOTE-RF模型,"在互联网+时代背景下,供应链金融服务方式从线下转移到线上,供应链金融信用风险也出现了新的特点。相应的风险评估方法和管理手段也应该不断改善,为更好管理控制供应链金融风险,基于线上供应链金融的视角将SMOTE算法和随机森林模型结合,对线上供应链金融融资模式特点进行分析的基础上,建立相应的信用风险评价指标体系,并对其进行主成分分析,使用C-SMOTE-RF模型得出较为准确可靠的结论,并提出有效的对策建议。",2018.0
基层推广PPP模式的对策建议,"<正>我国推广PPP模式以来,得到了基层的普遍认可和接受,但在基层实践操作过程中,也存在粗放发展等问题,容易引发新的财政金融风险。从这个意义上说,县级在大力发展PPP模式的同时,应更加注重规范性运作,防范化解系统性金融风险,回归PPP服务实体经济、服务基础性民生的本源,真正为县域经济社会发展加油助力。本文以山东省荣成市为例,对县级推进PPP模式的现状及制约因素进行分析研究。",2018.0
加权主成分距离聚类下金融安全指标评价体系构建与分析,"首先在前人研究的经典文献基础土选出有关金融安全指标体系的28个基础指标,并且根据当前经济金融发展形势和""十三五""规划战略导向,有选择地添加13个指标,构建了一套新的涵盖宏观经济安全、中观金融机构安全、微观金融市场安全、外部金融安全和金融软环境安全5个维度、41个指标的金融安全指标体系;然后根据这41个指标,运用加权主成分距离聚类分析法对中国金融安全2000-2014年的时间段进行聚类,分析2000-2014年这期间的金融安全影响程度和该期间的金融安全状况分别受哪些主成分的影响较大;最后,对中国金融安全指标的主成分进行综合评价,为国家或企业如何防范金融风险,保障金融安全提供参考建议.",2018.0
金融科技塑造金融未来,"<正>如今,金融科技(FinTech)引发了一场金融业适应信息时代的深刻变革。科技与金融的深度融合,打破了传统金融业的边界,重塑着金融业的服务方式,并越来越回归到金融所要解决的本源问题——资金如何在短缺方和盈余方之间高效便捷地融通。在金融科技的大潮中,区块链作为金融科技的底层技术架构,在很多方面重塑着金融业态。无论是传统金融服务,还是P2P、众筹等互联网金融创新,或在加强金融监管、防范金融风险、打击非法集资等领域,区",2018.0
以改革推动金融回归本源,"<正>金融改革必须以回归本源为根本,而本源是服务实体经济深化中国金融改革已迫在眉睫。原因在于,中国经济进入新常态,亟须金融业提供配套服务;金融乱象暗流涌动,不断积聚的金融风险必须严防死守。中共十九大明确提出,要深化金融体制改革,增强金融服务实体经济的能力,更要健全金融监管体系,守住不发生系统性金融风险的底线。",2018.0
金融科技与金融风险,"随着大数据、云计算、区块链、机器学习等新兴技术在金融的应用,金融科技的广度得到了快速扩充,随着互联网和金融的深度融合,行业边界的模糊,金融科技的深度得到了快速延展。金融科技的发展在促进金融效能提升的同时必将引发新的金融风险,如何在金融科技和金融风险间达到平衡,是每个金融从业者需要深度思考的问题,本文通过货币政策和金融科技的几个侧面进行了简要阐述,同时也展望了智慧金融。",2017.0
金融风险如何影响商业银行的创新能力——基于上市银行的理论分析与实证检验,"自中国经济进入新常态以来,金融市场竞争愈来愈激烈,金融风险对商业银行创新的影响越来越明显。为了研究金融风险对创新的具体影响,论文从信用风险、流动性风险以及利率风险三方面,理论分析了金融风险对商业银行创新能力的影响机制,进一步以沪深两家交易所公布的上市商业银行2010-2015年的数据,建立多元回归模型实证研究金融风险对商业银行创新能力的影响。实证结果显示信用风险对创新能力有正向影响,流动性风险对创新能力有负向影响但不显著,利率风险对创新能力有负向影响。最后,根据结论提出了关于提高创新能力的几点建议。",2017.0
“8.11汇改”后人民币汇率形成机制演进研究——基于货币篮子中货币权重变动的分析,"本文使用滚动回归及Chow检验等实证方法探究人民币汇率参考的货币篮子的构成与其在""8.11汇改""后的动态变化过程,以及人民币加入SDR这一事件是否使人民币汇率形成机制产生结构性变化。研究结果表明""汇改""后大多数货币的权重出现了较大幅度的波动,""汇改""使得货币篮子结构出现了多次改变,人民币汇率的灵活性显著提升,人民币加入SDR这一事件对货币篮子构成造成了结构性冲击。""汇改""也使人民币汇率短期内波动性提高,给中央银行货币政策操作带来挑战,央行应审慎地推进汇率改革进程,预防金融风险。",2017.0
农户生计风险对其生计资本的影响分析——以石羊河流域为例,"在发展中国家的农村地区,生计风险问题一直被密切的关注。由于资本市场的松散,生计风险可以大幅度地改变农户的资本所有和资本结构。现有文献主要针对生计风险特性研究、生计资本定量评估,而尝试探索生计风险对生计资本影响机制问题的研究仍较少。基于此,本文以石羊河流域为例,通过半结构式农户调查,在分别确定农户生计风险评估体系及生计资本评估体系的基础上,采取主成分分析方法对农户的生计风险(健康风险、环境风险、金融风险、社会风险和信息风险)和生计资本(人力资本、物质资本、自然资本、金融资本和社会资本)状况进行评估;通过建立相关计量分析模型,量化生计风险对农户生计资本的影响作用。结果表明:健康风险、环境风险和社会风险是影响生计资本最主要的风险因素。为此,政府决策与管理部门为了更好地控制生计风险,保障农户的可持续生计,一方面需要引导农户扩大生计途径、提高农户自身应对生计风险的能力;另一方面则需要控制、减少农户生计风险,构建生计风险预警体系与防范机制,形成有效应对生计风险的保障机制。",2017.0
