Article Title,Abstract,Publication Year
金融系统压力:指数化测度及其溢出效应研究,"2008年全球金融危机的爆发及其冲击促使监管者更多的关注全球金融市场的关联网络特征及金融风险在各金融市场间的传导机制.本文基于全球向量自回归模型(GVAR),从关联网络的视角构建了金融压力溢出效应模型,考察信贷市场、资本市场、外汇市场、债券市场和货币市场等五个金融子市场压力在不同国家和市场间的传导及其动态演变.研究结果表明,美国是全球金融市场中金融压力主要溢出者;发达经济体主要通过其资本市场和货币市场影响我国的信贷市场、资本市场和外汇市场,而新兴经济体金融压力则主要影响我国的债券市场和货币市场.资本市场和货币市场是不同国家和金融子市场间金融压力传染的重要路径.2014年以来国际金融市场压力对我国金融市场的影响远高于金融危机时期,且资本市场和外汇市场所受影响更为显著.",2020.0
商业银行开展绿色金融项目的主要影响因素研究,"金融风险在许多方面影响着商业银行开展绿色项目,产生风险的原因众多,制度体系、机构职能、思想观念等方面的因素会不同程度地影响金融企业开展绿色项目,哪些因素是绿色金融发展的主要因素需要进行探讨。以上市商业银行2013～2017年五年数据为样本,运用主成分分析法对政府的绿色项目支持力度、污染企业审核程度、坏账风险、环境意识等影响因素进行实证,提取出两个主成分因子,将两个主成分归纳为绿色金融发展环境和金融企业内部应对措施两方面。这表明绿色金融发展环境与金融企业内部应对体系作为最主要的两个影响因素对商业银行绿色项目的开展至关重要,并提出针对性建议。",2020.0
区块链金融业务模式构建与分类研究——基于初创企业的数据,"互联网金融在我国金融市场中发展迅速,其中特别重要的就是P2P网络借贷模式的出现,传统的网络金融服务面临着诸多问题需要改进。为了研究初创企业作为借款方的金融业务模式,我们引入区块链技术,深入研究了基于区块链技术的信任机制来降低金融风险。本研究在2019年5月至6月期间,通过互联网平台进行了社会问卷调查,一共发放问卷518份,得到有效问卷476份。通过相应的假设和回归分析可以看出,信息共享机制有利于促进互联网金融健康发展,对于借款者而言能够鼓励其履约形成,强化直接信任。将区块链技术应用于互联网金融业务中,能够构建区块链信任机制,进一步完善信息的分享和信息披露,进一步降低交易违约风险,实现无信任交易。文章将初创企业作为借款方,从出借方的角度来构建区块链金融信任机制,从而为推进我国P2P网络借贷的健康发展,缓解初创企业的资金需求等问题做出了有益的理论探索。",2020.0
重大突发公共事件下的宏观经济冲击、金融风险传导与治理应对,"重大突发公共事件所特有的紧迫性与不确定性为全球经济的发展带来了极大的挑战,2020年年初""新型冠状病毒肺炎""疫情的快速蔓延更使得全球股市剧烈震荡。在此背景下,如何准确考察""新冠""疫情等突发公共事件对我国宏观经济与金融市场的冲击影响,有效防范化解系统性金融风险并保障经济平稳运行,已成为影响我国经济发展全局的重大问题。由此,本文基于前沿的因子增广向量自回归模型,首先考察重大突发公共卫生事件对我国宏观经济与金融市场16个部门、共计174个变量的冲击影响。其次,采用新颖的风险溢出网络方法,研究全球""新冠""疫情事件下,我国金融市场各部门间风险传导关系的动态演变。接着,我们结合美股4次""熔断""等极端风险事件,考察""疫情之下""国际间金融风险传导的主要源头与溢出途径。最后,本文基于风险结构框架,进一步探讨了该时期全球资本市场的共振关系。在此基础上,我们对完善与""重大突发公共事件""相适应的宏观治理应对机制与风险防范对策提出了相关建议,从而有助于我们""守住不发生系统性金融风险的底线"",维护经济发展和社会稳定大局。",2020.0
四十年来货币政策的研究进展及中国特色,"改革开放四十年是中国经济发展转型的黄金时期,也是中国货币政策不断调整、走向成熟的关键时期。本文以1978—2018年四十年间中国知网和Web of Science收录的有关货币政策的文献为样本,利用信息可视化工具CiteSpace对文献数据进行文献共被引和聚类分析,分三阶段对国内外货币政策研究进行系统梳理,分析关键词和核心文献的时代特征、理论基础和发展趋势,形成了国内外货币政策研究的知识图谱。对比分析国内外相关文献发现,中国货币政策既顺应时代潮流,理论基础的演进与国际接轨,由货币主义学派演变为新兴的新古典综合派学派,又结合国情、社会主义市场经济体制以及转型经济体的客观实际,沿着市场化、稳增长、控风险三条主线探索前行,具有中国特色。知识图谱呈现出当前中国货币政策的三大研究热点:(1)以""系统性金融风险""""银行风险承担""为代表的风险管控;(2)以""结构性改革""""新常态""为代表的经济转型;(3)以""利率走廊""为代表的利率市场化。",2020.0
商业银行不良贷款成因实证浅析——基于宏观视角和省级面板数据的分析,"党的十九大报告将防范化解重大风险列为三大攻坚战的第一位。不良贷款已成为当前的主要金融风险隐患,这轮不良的产生主要源自外部宏观经济的变化和产业变化,商业银行面临的风险主要是信用风险。本文利用省级面板数据对宏观经济变化和产业调整对不良贷款形成进行了实证分析,建议:加大逆周期调节力度,应对经济下行压力;以科技为引领,加快产业结构转型升级;进一步深化金融供给侧结构性改革,促进金融回归本源。",2020.0
电商平台供应链金融风险研究——基于Logistic模型的分析,"电商平台利用自身技术优势与大数据基因的特点,在供应链金融中发挥着重要作用。本文采用定性与定量分析相结合的方法,依据定性分析中的融资企业信用风险评价指标体系,结合Logistic回归模型进行定量分析,得出企业偿债、盈利能力是影响供应链金融风险的主要因素。此外,企业信用政策与外部变量如核心企业状况、行业环境等也会对其产生影响。",2020.0
金融供给侧的结构性问题及改革建议——基于金融结构视角的比较分析,"深化金融供给侧结构性改革是今后一段时期金融工作的基本遵循。本文从金融结构视角入手,论述金融供给侧结构性改革的主线及其理论基础,从可量化角度对我国金融供给侧结构的现实表现进行比较分析。从整体来看,我国金融结构仍表现出银行主导型结构特征;从直接融资结构看,我国多层次资本市场体系已初具规模,然而各子市场内部结构失衡问题相对凸显;从间接融资结构看,我国以银行为主导的金融机构体系整体发育良好、风险可控,但在机构差异化、服务多样化等方面仍存较大完善空间;从金融开放结构看,我国金融机构与资本市场开放水平相对滞后,金融全面开放仍然任重道远。今后应在充分理解金融供给侧结构性改革内涵的基础上,调整优化金融体系结构,精准定位金融服务领域,防范化解金融风险,扩大金融业开放水平,创新金融服务模式,多措并举引导金融回归服务实体经济本职,走出中国特色金融发展之路。",2020.0
资本账户开放下SDR定值货币发行国金融风险传染性和波动性分析——以美国和中国为例,"本文选择美国和中国作为研究对象,在以混合法计算资本账户开放基础上,借鉴克利夫兰金融压力指数(CFSI)思路,测算资本账户开放下的金融风险,并运用贝叶斯向量自回归模型(BVAR)、广义自回归条件异方差模型(GARCH)/非对称自回归条件异方差模型(TARCH)分析金融风险的传染性和波动性。结果如下:美元和人民币成为特别提款权(SDR)定值货币以来,美国和中国混合资本账户开放度呈现出一旦SDR定值货币权重发生变化,其数值会表现出剧烈变动的特点;在美国和中国资本账户开放下的金融压力指数构成中,资本账户开放风险指数占据了重要位置;只有股票风险压力指数对美国和中国资本账户开放风险压力指数有传染性影响,但影响方向相反;货币风险压力指数、债务风险压力指数对美国资本账户开放风险压力指数有负向传染性影响,而中国则没有任何压力指数对资本账户开放压力指数有影响;美元和人民币成为SDR定值货币以来,美国金融风险波动具有非对称效应,而中国金融风险波动则具有波动聚集效应。",2020.0
金融系统风险预警方法研究——基于CNN的卷积神经网络模型,"金融风险影响实体经济发展,甚至可能引发金融危机,加强我国金融系统风险预警研究具有重要意义。研究根据金融系统性原则设计了一套金融系统风险指标体系,并基于Convolutional Neural Networks(CNN)卷积神经网络构建了一种金融系统风险预警模型。实验结果表明,与K-Nearest Neighbor(KNN)、Extreme Gradient Boosting(XGBoost)、Back Propagation Neural Networks(BPNN)神经网络模型相比,CNN卷积神经网络模型预警准确率高、性能优,是一种更有效的金融系统风险预警方法。",2020.0
中美金融市场极端风险溢出研究——基于MVMQ-CAViaR模型视角,"以中美股票指数、债券指数和利率变动数据为研究样本,采用多元多分位数条件自回归在险值模型,以多元多分位数条件自回归在险值为基础测度不同市态期间极端风险的溢出程度及溢出方向。同时使用分位数脉冲响应函数考察了不同金融市场在面对外部冲击时的动态变化。研究发现,中美金融市场间整体呈双向溢出效应。股市危机前,股票和利率市场仅存在单向溢出,债券市场不存在溢出效应。股市危机期间股票市场存在双向溢出,债券市场存在单向溢出。此外,相较于美国,中国金融市场从极端风险冲击中恢复更为缓慢。在金融开放的趋势下,我国金融市场要实现稳健发展,必须加快推出更加合理的避险产品和投资工具,以供投资者有效分散来自境外的极端金融风险。",2020.0
政府补贴、地方经济波动与实体企业金融化,"基于如何防范和化解系统性金融风险视角,以2008—2015年A股非金融类上市公司为样本,文章考察了作为一项政策工具的政府补贴对企业金融化的影响,同时还考虑了地方经济波动对政府补贴与企业金融化间关系的影响。研究发现:政府补贴降低了企业的金融化参与程度,且相对于市场化高地区的企业,这种影响在市场化低地区的企业中显得更强。同时还发现,随着地方经济波动增加,地方政绩诉求实现难度加大,此时政府补贴对企业金融化的负向影响被削弱,但这种现象仅在市场化低的地区企业中存在,在市场化高的地区企业中不存在。此外,文章基于工具变量法、聚类分析和变量替换等一系列检验进一步说明研究结论的稳健性。文章在拓展和丰富政府补贴和企业金融化研究视角的同时,不仅以政府补贴为载体成功地将政府主体纳入实业金融化的理论分析框架中,而且对当前政府出台防范化解系统性金融风险、经济""高质量发展""和实体企业""虚转实""的政策有重要参考意义。",2020.0
金融与实体经济关系及穿透式监管探析,"随着经济结构转型,金融业对外开放的速度进一步加快,为了提升自身竞争力,适应新的国内外经济形势,助力中国实体经济发展,金融业要回归本源,提升服务实体经济的能力。但现实情况却不容乐观,金融中介不断用伪创新规避监管,增加资金损耗,推高了实体经济的融资成本,增加了实体经济的融资难度。现有的监管模式难以应对金融中介互相配合加长资金链条的问题,需要引入穿透式监管。国务院办公厅于2016年提出穿透式监管,各金融监管部门在2016-2017年开展了金融领域去杠杆,并取得了实效。本文从源头分析金融与实体经济关系,梳理穿透式监管模式的演变过程,并分析穿透式监管对促进金融支持实体经济和降低系统性金融风险的作用。",2020.0
投资者情绪对异质股票市场的非对称影响,"投资者情绪是影响股票市场稳定的重要因素,而股票市场的异质性决定其敏感性的非对称影响。根据K-means聚类分析将股票市场划分为不同类型,并引入马尔科夫区制转移回归模型,研究在不同区制下投资者情绪对股票市场的动态影响机制。研究发现,投资者情绪在中小盘股票市场影响更为显著,且负作用于股票收益率;在高、低两类收益率中,股票高收益率对投资者情绪的反应更为敏感,体现了投资者情绪的非对称效应;在股票市场的正常区制期间,投资者情绪具有显著的作用,而在极端波动时期,投资者情绪并未存在明显作用。",2020.0
银行情绪与信贷周期,"大量理论和实证研究证明银行情绪能够通过影响信贷供给引起信贷周期波动。在中国的银行主导型金融体系下这一效应是否存在?本文选取中国人民银行公布的《银行家问卷调查报告》数据,利用主成分分析构建了银行情绪指标,并进一步采用交叉谱分析对银行情绪与不同性质信贷指标间的相关性及""领先-滞后""关系进行检验。主要结论与启示有:银行情绪波动明显领先于信贷周期波动,是其前瞻性指标;银行情绪与金融机构人民币贷款和信贷型影子银行的波动关联性最强,但相关性方向相反,表明银行情绪在监管宽松的表外业务中得到了充分释放,这不仅增加了系统性金融风险,而且削弱了货币政策等宏观调控政策的有效性;应将银行情绪视为系统性金融风险的监测指标,纳入到预期管理和宏观审慎监管工具箱。",2020.0
保险对家庭金融风险产品参与的影响研究——基于东中西地区差异视角,"本文应用CHFS2015数据,基于我国东中西部地区差异视角,分析了社会保险和商业保险对我国居民家庭金融风险资产参与程度的影响。结果表明,无论是社会保险还是商业保险的参与,都可以显著提高居民对金融风险产品的参与程度,且商业保险的促进作用大于社会保险。根据地区差异分组回归结果进一步表明,东中西部地区都能够受到保险的有效激励,但东部地区参与保险的激励作用明显大于中西部地区,在社会保险的作用下,西部地区受到的激励大于中部地区。本文的研究表明完善我国保险制度,建立保险和金融风险产品共同发展能有利于我国金融市场的改革和深化。",2020.0
基于FSCI指数的中国金融稳定性评估,"随着改革开放的深入,特别是""一带一路""战略的提出,中国和其他国家的交流合作更加频繁,中国金融稳定更容易受到外部经济波动的冲击和影响,关注和评估金融稳定性就显得尤为重要。本文在现有研究的基础上,从机构内部经营、金融市场环境、国内宏观经济、国际环境冲击四个方面选取不良贷款率等16个指标,采用HP滤波分析和主成分分析法构建中国金融稳定状态指数(FSCI)。得到如下结论,FSCI指数对金融稳定描述的准确性受基础指标权重影响很大,且权重差别大,波动性差别也大,得到的FSCI指数最近虽然上升,但波动性同时也上升,说明金融稳定性整体上升,但不确定性因素同时也上升。为此提出加强金融稳定监测,并对其监测方法进行改进,建立重点指标的动态监测和预警机制;加强银行市场、股票市场、期货市场、保险市场、房地产市场基础建设,完善各个市场的制度体系,增强各个市场抵御风险的能力;加强外债和外汇储备管理,优化其构成结构,建立多元化的外交关系等一系列措施。",2020.0
房价波动对系统性风险的影响——基于SRISK模型的研究,"本文在理论上分析了房地产价格波动对系统性金融风险的影响传导机制,基于SRISK模型得到系统性金融风险数值,并选取全国商品房平均销售价格,在此基础上构建向量自回归(VAR)模型进行实证研究。研究结果表明:房价波动是引起系统性金融风险的格兰杰原因,对其冲击影响较大。最后,基于实证结果对我国房地产市场提出政策建议。",2020.0
基于大数据的金融风险预警系统的研究,"历史大数据显示,政治、军事、金融、疫情事件是金融风险触发的重大因素,网民、投资者对事件的关注度越大,事件影响力随之扩大,从而把金融事件传播转向金融风险传染。通过用户量级、用户结构、用户行为、用户指数构建用户参与模型,并以此模型构建金融风险预警系统。系统通过采集2000年至2018年大量相关支撑数据,在建立风险指标、用户参与等各类数据库基础上,运用机器学习算法设计预警、预测系统,最终用系统采集的数据库进行效果分析和相关性检验,得出量化结论。",2020.0
老龄化背景下退休对城镇家庭金融资产选择的影响——基于模糊断点回归设计,"随着老龄化程度日益加深,我国退休人口将会呈现增长趋势。本文研究退休作为一种个体工作状态的外生冲击,如何影响家庭的金融资产选择行为。利用中国家庭金融调查微观数据,采用模糊断点回归设计的非参数估计方法,本文发现退休不会造成家庭风险金融资产配置比例发生显著变化,但会引起风险资产种类构成的明显变动,现金、股票和基金在家庭金融资产中所占比重显著下降,银行存款、理财产品和借出款所占比重则显著上升。影响机制检验发现,退休对家庭金融资产选择的这种影响,可能是通过退休之后家庭的风险态度变化、金融知识变化和收入冲击造成的。本文研究表明,对退休人口进行金融知识普及和金融风险教育十分必要。",2020.0
美国货币政策风险溢出效应分析——基于分位点向量自回归模型,"基于分位点向量自回归模型,利用2008年1月至2019年6月美国联邦基金目标利率、我国宏观经济、宏观金融、金融市场以及商品市场数据,系统分析美国货币政策对我国宏观经济金融的风险溢出效应。研究发现,美国货币政策对我国宏观经济、宏观金融、金融市场和商品市场的风险溢出效应表现出了非对称性。具体来看,美联储提高联邦基金目标利率对我国GDP增长率、消费者价格指数、进出口、银行间同业拆借利率、外汇储备、人民币汇率波动、债券、股票、基金和商品市场的风险溢出效应,在不同分位水平下存在差异,且在高分位水平和低分位水平不具有对称性。",2020.0
我国省域金融风险动态预警研究——基于浙江省月度样本数据的分析,"我国区域经济发展程度极不平衡使得部分重点省域对国家总体金融安全影响程度显著而突出,关注我国省域金融系统风险并进行提前预警与监管防范对于省域与国家金融安全尤为重要。本文立足金融市场深入扩大对外开放趋势背景下,构建了我国省域金融风险先行预警指标体系和金融风险压力指数,并以浙江省2004年1月—2016年12月样本数据为对象,通过TAR门限自回归模型和Ologit概率模型对省域金融系统风险状况进行了实证预警分析,研究发现:(1)省域先行预警指标统计检验发现,通货膨胀率与出口增长率对省域金融风险水平呈现显著负相关效应,而新增信贷额/工业增加值、固定资产投资增长率、消费增长率与进出口增长率对省域金融风险水平呈现显著正相关效应;(2)动态概率预警模型检验发现,省域上一月份的金融风险压力值对下一月份的金融风险压力值呈现显著负向影响效应,并使下一月份的金融压力风险起到一定程度的""熨平""作用效应;(3)通过统计检验比较发现,动态Ologit概率预警模型无论是从模型整体显著性与拟合优度,还是预测的准确度都明显优于静态概率预警模型;(4)通过近12个月的样本外数据对模型预警的稳健性检验发现,Ologit概率预警模型金融风险预测准确程度在严格区制上为25%,但大类区制预警准确度为50%,相对优于国内外同类型的模型预警效果。",2020.0
基于综合指数法的后发地区城市商业银行系统性金融风险测度与分析——以西北四省城市商业银行为例,"城商行系统性金融风险不仅关系到自身发展的安危,更易衍生为区域性金融风险,尤其在后发地区风险防范能力不足的情况下,会对当地经济造成严重冲击。本文选择我国后发地区最具有代表性的陕西、甘肃、宁夏、青海四省作为样本,构造微观层面与宏观层面衡量系统性金融风险的指标体系,通过综合指数法测度西北四省城商行系统性金融风险,分析以西北四省为代表的后发地区城商行系统性金融风险总体变动趋势与各省趋势,从而为后发地区城商行防范系统性金融风险提出对策建议。",2020.0
基于MIDAS分位数回归的条件偏度组合投资决策,"条件偏度是金融市场典型特征之一,忽略条件偏度的组合投资决策往往难以有效地分散金融风险。为此,本文构建了包含条件偏度的组合投资模型,并给出其建模方法。首先,运用MIDAS-QR模型,改善条件偏度测度效果;其次,基于CRRA效用函数,将组合投资权重设计为条件偏度和特征变量的线性组合,建立组合投资模型并给出求解方案;最后,从沪深300指数中选取10支代表性成分股进行实证研究,从收益、风险和Sharpe比率等方面,将包含条件偏度的组合投资模型与等权方案、均值-方差模型等进行比较,分析条件偏度在组合投资中的作用。实证结果表明:MIDAS-QR是测度条件偏度的有效方法,其测度结果受异常值影响小,表现稳定;条件偏度对组合投资决策具有显著影响,包含条件偏度的组合投资模型能够有效地降低投资风险、带来更高的风险调整收益。",2021.0
我国系统性金融风险与宏观经济波动关系:指标度量与动态影响研究,"选取四大类22个指标,利用因子分析法析出经济增长动力风险、证券市场泡沫风险、外部经济风险、房地产价格泡沫风险和经济脆弱性风险等构成我国系统性金融风险的5类风险因子,运用向量自回归模型分析了系统性金融风险及其5类风险因子对中国经济波动的动态影响。实证研究表明,各风险因子对经济增长的影响存在时滞性,影响程度和影响时长方面存在差异。证券市场泡沫风险、外部经济风险和房地产价格泡沫风险对经济增长的影响存在时滞性,外部经济风险对经济增长的负面影响程度最大,证券市场泡沫风险对经济增长的负面影响持续时间最长。基于此,提出了相关政策建议。",2020.0
房价波动与房地产金融风险的关系研究——基于格兰杰因果检验,"本文以房价波动与房地产金融风险的关系为研究重点,采用主成分分析法和格兰杰因果检验法对我国2008-2018年的房地产价格与房地产金融风险变化情况进行了实证分析。研究结果表明,房地产价格指标HP与反映房地产市场的景气程度以及房地产与国民经济的协调性的房地产金融风险指标REF2互为格兰杰原因,二者的关系是通过""房价上升-信贷扩张-资产价格上涨""的良性循环模式和""房价下跌-信贷紧缩-资产价格下跌""的恶性循环模式而相互作用的。通过对历年数据的分析,本文认为我国房地产市场正处于""房价上升-信贷扩张-资产价格上涨""的良性循环中,当前面临系统性房地产金融风险的可能性较小,但也应注意防范,避免房价泡沫滋生导致的房地产金融风险。",2020.0
基于动态Copula-CoVaR系统性风险的评估,"近年来,CoVaR模型是近年来衡量系统性风险的主流方法。现有的研究方法只关注了静态情形而忽略了动态情形,文章在Copula框架下考虑了DCCGARCH模型下的动态Copula-CoVaR模型和广义自回归得分(GAS)模型下的动态Copula-CoVaR模型,并对Co VaR进行了再次定义。在应用方面选取上证指数中具有代表性的6家金融机构从2014～2016年的股票数据,对选取的数据进行系统性风险评估。通过上述方法可以筛选出高危的金融机构,对金融风险防范工作具有一定的指导意义和参考价值。",2020.0
