Article Title,Abstract,Publication Year
新兴经济体经济政策不确定性对资本外流波动性的动态传递效应,新兴经济体经济政策不确定性和资本流动波动性的加剧极易引致系统性金融风险。基于新兴经济体样本国家2005—2020年分类账户资本外流数据，构建时变参数向量回归模型，分析源于新兴经济体母国的经济政策不确定性对其资本外流波动性的动态传递效应。研究发现，新兴经济体经济政策不确定性的提高增大了其资本外流波动性，该效应在金融危机、欧债危机和新冠肺炎疫情时期具有明显时变性特征，且在同一时期对不同账户的作用也呈现显著异质性。对影响机制的检验和对比发现，新兴经济体经济政策不确定性经由资产价格机制对其资本外流波动性的传递效应依次大于汇率机制和实物期权效应机制。因此，新兴经济体应构建经济政策不确定性指数及其变动预警体系，同时加强对资本账户尤其是短期资本流动的宏观审慎与微观监管，防控资产价格泡沫，避免系统性风险通过跨境资本流动渠道交叉传染。,2022.0
中国上市商业银行尾部风险溢出效应研究,市场信息对金融风险具有一定的影响，在利空消息和利好消息冲击下厘清商业银行的尾部风险溢出对于整个金融市场体系的稳定和寻找经济新的增长点均具有重要的指导意义。本文考虑利空消息和利好消息的非对称风险影响，对传统CoVaR模型的危机条件进行了改进和扩展，并通过分位数回归的方法来估计改进的CoVaR模型，对商业银行的上尾和下尾极端风险溢出效应进行了系统的分析。实证结果表明，商业银行的上尾和下尾风险溢出具有显著的非对称性，其风险更容易受到来自利空消息的冲击和影响，另外，相比于股份制商业银行，国有商业银行的风险溢出效应较大，风险波动程度更大。最后，结合商业银行的实际状况，提出相关的风险防控建议。,2022.0
中国房地产企业间系统性风险溢出效应分析——基于尾部风险网络模型,"本文以2007—2021年沪深A股上市房企为样本，首先基于SIM单指数分位数回归技术提出测量系统性风险的新指标SIM-CoVaR,并结合前沿的TENET网络模型，构造跨房地产企业风险动态传染的尾部风险网络，然后采用块模型探究房地产市场系统性风险溢出的聚类性、触发机制及传播路径，最后考察网络整体结构和宏观经济变量对房地产市场系统性风险溢出的影响。研究表明：(1)我国房地产企业间存在明显的系统性风险联动性和溢出效应，在市场动荡时期房地产部门是金融风险溢出的放大器；(2)评估系统重要性节点企业时，除考虑企业规模等内部属性，还应考虑房企间关联结构，利用系统性风险指数可有效捕捉网络中系统重要性节点；(3)跨房企的系统性风险溢出具有显著的聚类特征，尾部风险网络可被划分为4个不同的功能模块，各模块的成员及其角色呈现明显的时变特性，监管部门可据此从供给端“因企施策”;(4)网络聚集性、网络效率和网络匹配性的降低能显著降低房地产市场的系统性风险溢出效应。本文从企业微观层面探讨房地产市场风险的形成机制，为促进房地产业健康发展和防范化解宏观层面的系统性金融风险提供参考。",2022.0
我国行业风险敞口与行业网络结构的相关性研究,基于皮尔逊相关系数和格兰杰因果检验，分别构建行业无向和有向网络，采用CoVaR模型计算我国行业风险，并借助分位数回归探索行业风险与网络结构的相互关系；使用网络模块分析探究不同极端事件下行业网络的集聚情况，以及风险在各模块间的传染路径，同时考察网络结构对行业风险的影响效应。研究结果表明：两种行业网络结构均表明，金融行业有成为网络中心的趋势，采用格兰杰因果检验构建的有向网络更能解释行业风险；金融市场冲击会对行业网络结构产生影响，不同极端事件下行业风险在网络中的传播方式不同；同时，网络结构对行业风险存在显著影响，网络聚类系数和全局效率的降低以及介数中心性的提升，均能降低行业风险。研究结论对金融风险防范和产业结构优化升级具有一定的参考价值。,2024.0
融合RACNN和BiLSTM的金融领域事件隐式因果关系抽取,"金融领域的文本信息量大、价值高，尤其是其中的隐式因果关系事件包含着巨大的潜在利用价值。对金融领域文本进行隐式因果关系分析，挖掘隐式因果关系事件中隐含的重要信息，了解金融领域事件更深层的演化逻辑，进而构建金融领域知识库，对金融风险控制、风险预警等具有重要意义。为了提高金融领域中隐式因果关系事件识别的准确度，从特征挖掘的角度入手，提出了一种基于自注意力机制的融合循环注意力卷积神经网络(Recurrent Attention Convolution Neural Network, RACNN)和双向长短时记忆网络(Bidirectional Long Short-Term Memory, BiLSTM)的隐式因果关系抽取方法。该方法结合了基于迭代反馈机制能提取更重要文本局部特征的RACNN、能更好地提取文本全局特征的BiLSTM以及能更深入地挖掘融合特征语义信息的自注意力机制，在SemEval-2010 Task 8数据集和金融领域数据集上进行了实验，结果表明，评估指标F1值分别达到了72.98%和75.74%,均显著优于其他对比模型。",2022.0
“一带一路”沿线国家风险、双边投资协定与中国OFDI区位选择——基于PLS-PM与BP神经网络模型的实证研究,构建包含政治军事风险、经济金融风险和社会文化风险的“一带一路”沿线国家风险指标体系，采用偏最小二乘通径模型和BP神经网络技术实现了风险测度与预警。基于2014—2019年“一带一路”沿线49个国家数据，建立扩展的投资引力模型，运用动态面板系统GMM估计，实证分析东道国风险、BIT对中国OFDI区位选择的影响。研究发现：总体上看，中国OFDI主要流向了风险较高的国家，在政治军事和社会文化维度表现为风险偏好，而在经济金融维度上风险规避的特征明显。非商业趋向和非市场动机使得中国OFDI能够包容一定的国家风险。签订BIT可以促进中国对“一带一路”沿线国家的OFDI，在中低收入国家对投资者的保护作用更强。此外，中国OFDI的区位选择存在“异质性偏好”，中低收入国家风险对中国OFDI的影响程度显著高于高收入国家，不同收入水平国家的市场规模、资源禀赋、技术和税负对中国OFDI的影响也有所不同。,2022.0
数字货币对跨境资金流动的影响与对策研究,随着数字货币使用场景的不断拓展，尤其是有央行背书的法定数字货币的深入发展，未来数字货币作为传统货币的补充在跨境支付和结算场景应用的可能性持续增强。在此背景下，研究数字货币对跨境资金流动的多维度影响，对于全面审视数字货币给跨境支付领域带来的机遇和挑战、以及新机遇下如何完善数字货币监管体系、防范化解金融风险和维护金融稳定都具有积极意义。本文在全面阐述数字货币对跨境资金流动影响基础上，通过构建向量自回归模型以及利用脉冲响应及方差分解方法，实证分析数字货币对我国跨境资金流动的潜在影响。研究结果表明，数字货币将放大跨境资金流动的波动性，减弱跨境资金流动“惯性”，对跨境资金流动的影响也将随着时间推移逐渐凸显。基于此，本文就如何应对数字货币对跨境资金流动的影响提出对策建议。,2022.0
双循环中的金融资本空间化：叙述逻辑、历史考察与理性回归,金融支持双循环是构建新发展格局的重要内容，这在马克思主义政治经济学语境下表现为金融资本的空间拓展问题，因此本文基于马克思的经典资本循环理论，结合已有的资本空间化研究成果，构建了兼具理论抽象力和解释力的双循环下金融资本空间化分析框架，它不仅包括金融资本从介入实体经济循环到形成独立运行的虚拟经济循环，而且包括从内循环到外循环的纬度扩张，由此形成金融资本空间化的叙述逻辑。在此基础上从历史视角揭示了金融资本过度空间化在双循环中产生的经济失衡，即它在内循环中表现为挤压实体经济循环和虚拟经济自我膨胀形成金融风险，在外循环中强化贸易失衡、增加金融投资和实体投资的脆弱性以及压缩宏观经济政策空间。因此有必要从重构金融资本在实体经济和虚拟经济中的发展空间以及构建金融资本内外循环中的空间平衡机制两个方面入手，以期将金融资本的积累和循环控制在合理的范围内，积极发挥金融资本在双循环中的支撑功能。,2022.0
机器学习解构区域金融风险防控研究进展,区域金融风险防控（RFRP）无论在管理区域传统金融风险（TFR）还是坚守不发生区域金融系统风险（FSR）中都是不可或缺的。随着大数据规模的持续增长，金融风险形态变化的不确定性，传统计量方法模拟金融风险防控的效率、精度、应用等方面都面临着无法克服的困境。当下，越来越多的机器学习（ML）模拟RFRP防控的新方法和新技术受到研究者的重视。首先提出了RFRP防控新的科学分类和ML观念基础；其次总结了区域TFR防控的ML理论方法和应用技术，对各类代表性研究所论述区域TFR防控的关键逻辑、模型算法、学习效果进行了比对解析，对ML不同方法的优点、局限和传统场景进行了归类分析；然后梳理了区域FSR防控的ML理论方法和应用研究，对各类典型文献所解析区域FSR防控的关键脉络、ML算法、学习效果进行了对比研究，对ML不同模型的优势、缺陷和金融风险场景进行了阐述研究；最后提出了六个ML模拟RFRP防控的前景技术和新兴方向。,2022.0
城商行龙头北京银行的股票价格预测研究——基于深度神经网络模型,目前我国城市商业银行规模体量庞大，该板块市值稳定关乎金融稳定大局，而作为其龙头的北京银行发挥着行业标杆导向作用，故有必要对其股价进行预判，与实际股价进行比较，从而发现是否有突发重大风险，提前布局应急处置机制，启动相应市值管理预案。深度神经网络模型中的LSTM对有记忆性的数据的预测有较好的拟合效果，本文运用LSTM模型对北京银行的股价进行建模分析，研究发现其当前股价对一周内的行情数据高度敏感，究其原因是其股票价格已长期稳定地反映了自身价值，短期冲击影响在股价变动中会起主导作用。市值管理机构和管理层在日常监管过程中应着重关注其短期波动与模型预测值的偏离是否达到预警级别，防范化解重大金融风险。,2022.0
元宇宙时代馆藏资源运营的法律风险与合规问题,随着数字互联技术的快速发展，“元宇宙”概念已经在全球兴起。在此背景下，博物馆可以通过馆藏资源NFT化和展馆虚拟现实化两大途径融入元宇宙。NFT作为一种新的产品形式，基于区块链的底层技术，成为与实体作品一样可以被确权的载体，具有高度真实性和稀缺性。虚拟现实技术的不断发展，使得博物馆可以建立高交互性、高创作自由度的虚拟展馆。博物馆需要在坚守公益性定位的同时，透过商业表象，回归NFT、虚拟展馆等的法律属性本质，探析新模式下的法律风险。同时，博物馆应当理性地看到超前概念和技术现实的距离，在拥抱元宇宙的同时，做好内容合规审查、知识产权合规与维权、个人信息安全合规审查乃至金融风险排查等工作。,2022.0
高频数据下基于LSTM的协方差矩阵预测模型,"协方差矩阵的建模与预测，对于金融风险管理、投资组合管理等至关重要。针对时间序列模型对高维变量预测精度较低的问题，利用长短记忆神经网络模型(LSTM),提出了基于深度学习的高频数据已实现协方差矩阵预测模型。利用金融高频数据得到已实现协方差矩阵，对其进行DRD分解，针对相关系数矩阵R进行向量化处理，利用向量异质自回归模型(HAR)预测已实现相关系数矩阵R;针对已实现波动率矩阵D,利用半协方差(semi covariance)思想，结合LSTM模型，得到已实现波动率矩阵D的深度学习预测模型，构建了LSTM-SDRD-HAR已实现协方差矩阵动态预测模型。LSTM模型和HAR模型能捕捉实际数据的长期记忆性，半协方差有利于捕捉金融数据的杠杆性。实证分析表明：相较于传统向量HAR已实现协方差矩阵预测模型，LSTM-SDRD-HAR预测已实现协方差矩阵更为准确，基于LSTM-SDRD-HAR预测已实现协方差矩阵构造的有效前沿组合投资效果更佳。",2022.0
金融化、杠杆率与系统性金融风险,本文研究我国经济金融化对杠杆率以及系统性金融风险的影响，从宏观和微观两个层面测度杠杆率水平，基于8个经济部门的24个相关因子抽取系统性金融风险信息，利用时变参数因子增强向量自回归(TVP-FAVAR)模型构建杠杆率、金融化和系统性金融风险间的动态关系，并进一步研究杠杆率和金融化的溢出效应及其对系统性金融风险的影响。基于2004—2019年季度数据的经验分析结果表明：金融化程度的提升对宏观杠杆率产生正向冲击，对微观杠杆率产生负向冲击，且冲击在2008年后快速减小；宏观杠杆率在2008年金融危机前对系统性金融风险产生负向冲击，而在2008年后转为正向且冲击逐渐增大，微观杠杆率对系统性金融风险的冲击与宏观杠杆率相反。这些结果表明，综合考虑宏观和微观杠杆率对系统性金融风险的差异化影响，可以更好地防范和化解系统性金融风险。,2022.0
银行理财需平衡七大关系,<正>2018年以来，以资管新规为代表的一系列新政的出台在促进我国资管行业回归本源、提升资管行业服务实体经济质效、防范化解重大金融风险等方面都具有重大意义。三年多来，在金融管理部门的统一领导下，伴随着以资管新规为核心的行业统一监管框架日趋完善，银行理财以规范带转型，以转型促发展，回归“受人之托，代人理财”的资管本源，,2022.0
人民币国际化进程中的系统性金融风险研究——基于SV-TVP-SVAR模型的分析,通过梳理人民币国际化对系统性金融风险影响的传导机制来构建中国系统性金融风险指数。结合中国系统性金融风险的时变特征，使用时变参数向量自回归模型（SV-TVP-SVAR）实证验证了人民币国际化对系统性金融风险的影响。研究表明，人民币国际化进程中可能产生系统性金融风险；进一步研究发现，2008年、2009年、2015年及2019年人民币国际化的时点变化对系统性金融风险的冲击不同。人民币国际化对系统性金融风险的冲击作用会随着人民币国际化进程的推进而增强。因此，要优化人民币国际化路径，应着重避免该过程中系统性金融风险的触发与传导，稳慎推进人民币国际化。,2022.0
基于随机矩阵理论的加密货币网络拓扑性质研究,金融资产之间的关联往往表现为一个复杂动态系统，不同资产之间存在着显著的联动性。对金融资产之间相依关系、风险传导的深入研究不仅能够及时防范风险冲击，规避损失，而且对促进金融市场健康发展具有重要意义。基于随机矩阵理论探讨加密货币网络拓扑性质，选取2018年3月20日至2019年12月31日37种主要加密货币为研究对象，运用非线性DCCA相关系数和传统的线性相关系数构建加密货币之间的相关系数矩阵，同时运用随机矩阵理论对两种相关系数矩阵进行去噪过滤，在不同的阈值下构建加密货币网络，研究加密货币之间的相依结构、网络拓扑性质和各加密货币的风险传染强度。研究结果表明，加密货币之间的非线性相依关系更加强烈。加密货币网络呈现出小世界效应，在不同的阈值下，加密货币网络的连接关系强度不同。当阈值较小时，加密货币网络比较稠密且稳定性较强；当阈值较大时，加密货币网络比较稀疏，此时加密货币网络的平均度和平均聚类系数也较小；并且两种相关系数矩阵下的加密货币网络主要表现为异配性。进一步研究发现，加密货币市场中存在大量随机噪声，根据随机矩阵理论去噪后加密货币之间的相关关系更加紧密，在同一阈值下去噪后加密货币网络平均度和平均聚类系数有所增大，异配性更加明显。通过对加密货币网络风险传染实证分析可知，以太坊和艾达币的风险最容易在网络中传染给其他加密货币。加密货币网络呈现出不同的局部时变特征，并且阈值较小时，网络的局部时变特征更加稳定。实践中建议最好从非线性的角度测量加密货币之间的相依关系，并且要考虑相依关系的动态性；从事加密货币的投资者要时刻注意加密货币资产之间的风险传导，特别是以太坊和艾达币对其他资产的影响；建议相关金融风险监管者加强对加密货币的监管，保证金融市场的健康发展。,2022.0
互联网信贷与大学生信贷观念研究,随着互联网金融消费信贷产品的快速发展，大学生的互联网消费贷款已经成为普遍现象，而网络信贷风险防控已成为当前急需解决的重要问题。大学生的消费理念、信贷观念和网络借贷之间存在着一定的相关性，充分理解消费理念和网络借贷之间的关系，对制定对应的政策，进一步降低网络信贷的金融风险和社会风险具有较大帮助。文章运用问卷调研、Stata回归分析等文献研究方法，基于规范大学生互联网信贷视角，从花呗借呗等互联网消费贷款出发，对互联网信贷与大学生信贷观念之间的关系进行研究，分析禁止花呗借呗向大学生放贷的利与弊，进而给出相应的建议。,2022.0
基于主成分分析的县域金融综合压力指数构建——以甘肃省肃南县为例,本文从防范金融风险的视角出发，采用主成分分析法，选取甘肃省肃南县2011—2020年的区域经济指标和金融机构风险指标，基于肃南县经济金融发展现状，进行实证研究，结果表明：（1） 2011—2012年肃南县金融综合压力指数整体上处于较低水平，金融压力相对较小；2013—2015年金融综合压力指数上升较快，2013年达到近年来最高水平，该阶段金融体系的压力风险快速上升；2016—2018年金融综合压力指数处于相对较低的位置，表现为整个金融体系的风险较低，金融综合压力指数变化较为平稳；2019年以来，在经济发展增速放缓的驱使下，金融风险有上升趋势。提出应通过加大信贷投放力度、完善地区金融稳定合作协调机制、促进银行业金融机构资产优化、加大对金融体系的监管等政策措施防控金融风险，助力地方经济发展。,2022.0
发挥地方AMC专业作用：聚焦主业 履职尽责,<正>从2014年第一批地方AMC获批至今，历经近8年的磨砺，地方AMC已逐步成长为区域金融市场的中坚力量。当前，应积极发挥自身在地域资源、流转渠道、市场专注度等方面的优势，围绕不良资产及问题资产的处置地方AMC、管理与盘活，不断拓宽业务路径，加速回归主业、脱虚向实。党的十八大以来，习近平总书记对金融工作提出了一系列重要指示批示和系统论述，将防控金融风险放在了更加重要的位置。党的十九大报告指出，要深化金融体制改革，增强金融服务实体经济能力，健全金融监管体系，守住不发生系统性金融风险的底线，要坚决打好防范化解重大风险、,2022.0
货币政策、银行竞争力与银行风险承担——基于系统GMM方法的实证研究,银行竞争力是商业银行防范系统性金融风险的综合能力反映，为更深层次地探索其在货币政策银行风险承担渠道中的作用，文章使用主成分分析法以2011—2019年26家商业银行为研究样本，计算得出各类银行的综合竞争力指数。在此基础上，基于系统GMM方法验证了我国货币政策银行风险承担渠道的存在性，同时发现货币政策与银行竞争力显著正相关。进一步，文章拓展性验证了银行竞争力在货币政策风险承担渠道中的“中介效应”，即货币政策的宽松，会使银行竞争力减弱，进而增加银行的风险承担意愿。基于以上研究结果，文章从货币政策制定当局和商业银行两个角度提出防范金融风险尤其是银行风险的对策建议。,2022.0
基于GARCH-ELMAN模型的人民币汇率预测,随着经济全球化的日益深入，人民币汇率的变动不仅影响着中国经济，对世界主要经济体的影响也举足轻重。本文采用2010年1月1日～2021年11月30日美元兑人民币汇率序列为研究对象，引入ELMAN神经网络方法，并结合经典计量经济学方法，构建多种时间序列模型和神经网络模型及二者组合模型进行实证分析，并以均方误差MSE作为模型预测精度的评价准则，发现将序列分解为线性部分和非线性部分的模型精确度明显较高，且EGARCH-ELMAN模型对序列的预测最准确，且绝对预测精度也达到较高的水平，这对美元兑人民币汇率预测具有重要的借鉴意义，进而对国家稳定外汇市场和防范短期大规模资金流动带来的潜在金融风险具有重大实践意义。,2022.0
资本约束和流动性约束的协调效果检验——基于银行风险承担的视角,本文运用面板平滑转换回归模型分析资本约束和流动性监管约束双重约束框架的协调效果。研究发现：流动性监管工具降低银行风险承担的效果随着资本监管要求的提高而加强，而由于当前中国大多数商业银行的流动性水平处于较高位置，导致资本监管降低银行风险承担的效果随着流动性水平的提高而被弱化；在经济下行压力加大和金融风险凸显的背景下，国有大型商业银行运用资本监管和流动性监管工具防范风险的效果明显强于城市商业银行和农村商业银行。,2022.0
湖南区域金融风险预测及防范,金融体系的稳定安全运行是维持经济发展的重要因素。通过运用RBF神经网络构建湖南区域金融风险预测模型，探究湖南金融风险状态，并给出相关政策性建议，具有现实指导意义。,2022.0
我国金融中介杠杆顺周期性比较研究,金融中介的高杠杆及其顺周期性是引发金融危机的重要因素，深入研究杠杆的顺周期对于优化监管、防范系统性金融风险以及稳定实体经济具有重大意义。本文以我国金融体系三大支柱——商业银行、证券公司和保险公司为研究对象，选用2010—2019年数据，运用面板数据回归方法对三者杠杆顺周期行为的存在性及影响因素进行研究，通过比较分析得出以下结论：一是我国金融中介存在杠杆顺周期行为，二是不同类型金融中介对杠杆顺周期的敏感程度存在差异，三是相同因素对不同类型金融中介杠杆顺周期的影响存在差异。最后结合分析结果，将三者对系统性金融风险的贡献进行排序，由大到小为：商业银行>证券公司>保险公司。,2022.0
基于机器学习的地方政府隐性债务风险先导预警模型,地方政府隐性债务已经成为系统性金融风险的潜在触发点，为了防范隐性债务风险，文章构建了地方政府隐性债务风险先导预警模型。使用修正的KMV模型测度隐性债务违约概率，依据违约概率设计预警模型输出指标，构建了包含17个指标的输入指标体系，使用多种机器学习方法对预警模型进行训练，选取最优方法构建先导预警模型。实证结果表明：使用随机森林方法可训练出最优的地方政府隐性债务风险先导预警模型，其准确率在91.94%～99.35%，具有较强的精确性和先导预警性。预警模型输入指标体系不仅可以预测隐性债务绝对风险等级，还可以预测隐性债务风险动态变化。进一步分析发现，地方政府隐性债务风险主要来源于隐性债务规模的快速扩张，而非地方政府偿债能力的弱化，其中以城投债、PPP项目以及地方国有企业的相关指标对隐性债务风险的预测能力最强。,2022.0
