Article Title,Abstract,Publication Year
Research on Pricing Methods of Convertible Bonds Based on Deep Learning GAN Models,"This paper proposes two data-driven models (including LSTM pricing model, WGAN pricing model) and an improved model of LSM based on GAN to analyze the pricing of convertible bonds. In addition, the LSM model with higher precision in traditional pricing model is selected for comparative study with other pricing models. It is found that the traditional LSM pricing model has a large error in the first-day pricing, and the pricing function needs to be further improved. Among the four pricing models, LSTM pricing model and WGAN pricing model have the best pricing effect. The WGAN pricing model is better than the LSTM pricing model (0.21%), and the LSM improved model (1.17%) is better than the traditional LSM model (2.26%). Applying the generative deep learning model GAN to the pricing of convertible bonds can circumvent the harsh preconditions of assumptions, and significantly improve the pricing effect of the traditional model. The scope of application of each model is different. Therefore, this paper proves the feasibility of the GAN model applied to the pricing of convertible bonds, and enriches the pricing function of derivatives in the financial field.",2023
Merged LSTM-MLP for option valuation,"Traditional option pricing models rely on estimates of expected volatility. The true volatility is not directly observable and must hence be estimated, inevitably with error. Any measurement errors immediately translate into inaccurate pricing, leading to potential losses for economic agents trading options for hedging or speculative purposes. This paper proposes a novel merged LSTM-MLP model for option pricing that circumvents the need for an explicit volatility estimate, leading to more accurate valuations. Through extensive out-of-sample testing on S&P500 call options data from 2015 to 2022 we document the statistical accuracy and economic benefits of the model when compared to relevant benchmarks. The superior performance is enabled by the combined LSTM-MLP architecture, which simultaneously utilizes both time series data and the cross-section of observed option characteristics in a deep learning neural network that accurately captures the complex price dynamics. The results are consistent over time and robust across option moneyness and time-to-expiry.",2025
An Intelligent Learning and Ensembling Framework for Predicting Option Prices,"Estimating option prices and implied volatilities are critical for option risk management and trading. Common strategies in previous studies have relied on parametric models, including the stochastic volatility model (SV), jump-diffusion model (JD), and Black-Scholes model (BS). However, these models are built on several strict and idealistic assumptions, including lognormality and sample-path continuity. In addition, previous studies on option pricing mainly relied on its own market-level indicators without considering the effect of other concurrent options. To address these challenges, we propose an intelligent learning and ensembling framework based on convolutional neural network (CNN). Specifically, the customized nonparametric learning approach is first utilized to estimate option prices. Second, several traditional parametric models are also applied to estimate these prices. The estimated prices are combined by a CNN to obtain the final estimations. Our experiments based on Chinese SSE 50 ETF options demonstrate that the proposed intelligent framework outperforms the traditional SV model, JD model, and BS model with at least 41.52% performance enhancement in terms of RMSE.",2021
Deep learning-based least squares forward-backward stochastic differential equation solver for high-dimensional derivative pricing,"We propose a new forward-backward stochastic differential equation solver for high-dimensional derivative pricing problems by combining a deep learning solver with a least squares regression technique widely used in the least squares Monte Carlo method for the valuation of American options. Our numerical experiments demonstrate the accuracy of our least squares backward deep neural network solver and its capability to produce accurate prices for complex early exercisable derivatives, such as callable yield notes. Our method can serve as a generic numerical solver for pricing derivatives across various asset groups, in particular, as an accurate means for pricing high-dimensional derivatives with early exercise features.",2021
Option price forecasting using neural networks,"In this research, forecasting of the option prices of Nikkei 225 index futures is carried out using backpropagation neural networks. Different results in terms of accuracy are achieved by grouping the data differently. The results suggest that for volatile markets a neural network option pricing model outperforms the traditional Black-Scholes model. However, the Black-Scholes model is still good for pricing at-the-money options. In using the neural network model, data partition according to moneyness should be applied. Those who prefer less risk and less returns may use the traditional Black-Scholes model results while those who prefer high risk and high return may choose to use the neural network model results. (C) 2000 Elsevier Science Ltd. All rights reserved.",2000
"A hybrid approach of wavelet transform, ARIMA and LSTM model for the share price index futures forecasting","In this study, a novel hybrid model for share price index futures forecasting named WT-ARIMALSTM is proposed. In this hybrid model, share price index futures are decomposed to extract data characteristics at different time scales by the wavelet transform and the ARIMA-LSTM model are applied to predict the close price of futures. The findings of the study are as follows. 1) The DWT hybrid model and the MODWT hybrid model have higher forecasting accuracy than some commonly used forecasting models under the three metrics of MAE, MAPE and RMSE. The DWTARIMA-LSTM model has better forecasting performance when the forecasting performance in different markets and the operational efficiency of the method are combined. 2) The DWT method is more applicable than the MODWT method in forecasting models of futures closing price series; the approximate signals obtained from the DWT decomposition have lower volatility and can better characterise the original signals. 3) The LSTM model has better prediction performance for noisy residual series, while the ARIMA model has better prediction performance for less noisy approximate signals. 4) Based on the forecasting results, a timing trading strategy is constructed that can maintain a robust return performance under different market conditions, especially on the risk side with significant advantages. In addition, this work examines the impact of the unexpected event of the COVID-19 epidemic on the forecasting performance of the model, and the results show that the model can adapt to different data structures to achieve more robust forecasting performance. This work provides insights into the integration of deep learning methods with econometric methods in the field of asset pricing.",2024
Energy price prediction based on decomposed price dynamics: A parallel neural network approach,"The growing uncertainties of the world due to geographic tensions, and weather conditions challenge the traditional method to achieve a reliable price prediction of energy future for both asset pricing and risk management. Following the initial success of deep learning models in energy price prediction, we attempt to establish a better architecture of neural networks to improve the prediction accuracy. We propose a novel Parallel Hybrid Neural Network (PHNN) model that utilizes independent sub-networks to effectively capture the distinct features of various sequences. Empirical results demonstrate that the PHNN model exhibits a significant performance enhancement of 16.68%, 14.09%, and 2.34% over the EMD-LSTM, the informer model, and the single LSTM model, respectively. In particular, the PHNN outperforms the single LSTM, which is trained on the same inputs, by 2.34% overall while by a remarkable 4.11% during event periods. This suggests that the PHNN derives notable benefits from its distinct architecture, particularly during the initial phase of extreme events characterized by significant price trend changes. Additionally, the study explores the potential benefits of incorporating additional event-tracking indicators for energy futures price forecasting. However, the findings suggest that these indicators may not consistently provide effective complementary information.",2024
Heston-GA Hybrid Option Pricing Model Based on ResNet50,"(1) Background. This study aims to improve the accuracy of the pricing model. (2) Methods. Heston model is combined with ResNet50 convolutional neural network model. Based on the optimization of Heston model parameters by genetic algorithm (GA), ResNet50 model is used to correct the deviation between market option price and Heston price, so a new hybrid option pricing model is established based on the empirical research on the European call options of Huatai-PB CSI 300ETF (code 510300), Harvest CSI 300ETF (code 159919), and SSE 50ETF (code 510050). (3) Results. The pricing result of the hybrid model is better than other single models and hybrid models. The model is applicable to the pricing of options with short and long remaining terms. (4) Conclusions. It is shown that the combination of Heston model and ResNet50 model with optimized parameters can ensure the interpretability of the model and enhance the nonlinear fitting ability of the model, which confirms the effectiveness of the hybrid model and provides a reference for investors and institutions to make scientific decisions.",2022
A Synergetic Approach to Ethereum Option Valuation Using XGBoost and Soft Reordering 1D Convolutional Neural Networks,"In an ever-evolving realm of cryptocurrencies, Ethereum has emerged as a prominent player, captivating both investors and enthusiasts alike. Within the diverse financial landscape of cryptocurrencies, options stand out as a versatile tool, offering flexibility and hedging opportunities. This paper introduces a cutting-edge approach to pricing Ethereum options, harnessing the formidable power of XGBoost and the visionary capabilities of Convolutional Neural Networks (CNN). This research proposes a novel method that utilizes XGBoost for implied volatility estimation by integrating historical volatility, and generalized auto-regressive conditional heteroscedasticity (GARCH) model-predicted volatility. Subsequently, a soft reordering 1-dimensional CNN (1D-CNN) model is employed to enhance the pricing accuracy of Ethereum options. The soft reordering mechanism is used to dynamically rearrange the initial tabular dataset, optimizing it for enhanced learning within the CNN framework. The outcome indicates the ability of the proposed model in estimating implied volatility and pricing options with remarkable accuracy, outperforming traditional option pricing models and data-driven models documented in literature. The proposed model also exhibits the lowest pricing error across all maturities and various moneyness criteria, with the exception of long term put and deep out of the money (DOTM) options.",2025
Numerical solving of the generalized Black-Scholes differential equation using Laguerre neural network,"Reasonable pricing of options in the financial derivatives market is crucial. For American options, or when volatility and interest rate are not constant, it is often difficult to obtain analytical solutions to the Black-Scholes (BS) equation. In this paper, the Laguerre neural network was proposed as a novel numerical algorithm with three layers of neurons for solving BS equations. The validity period and stock price are the input of the network, and the option price is the only output layer. Laguerre functions are used as the activation function of the neuron in the hidden layer. The BS equation and boundary conditions are set as penalty function, the training points are uniformly selected in the domain, and the improved extreme learning machine algorithm is used to optimize the network connection weights. Three experiments calculated the numerical solutions of BS equations for European options and generalized option pricing models. Compared with existing algorithms such as the finite element method and radial basis function neural network, the numerical solutions obtained by Laguerre neural network have higher accuracy and smaller errors, which illustrates the feasibility and superiority of the proposed method for solving BS equations. (C) 2021 Elsevier Inc. All rights reserved.",2021
On sparse grid interpolation for American option pricing with multiple underlying assets,"In this work, we develop a novel efficient quadrature and sparse grid based polynomial interpolation method to price American options with multiple underlying assets. The approach is based on first formulating the pricing of American options using dynamic programming, and then employing static sparse grids to interpolate the continuation value function at each time step. To achieve high efficiency, we first transform the domain from Rdto (-1, 1)d via a scaled tanh map, and then remove the boundary singularity of the resulting multivariate function over (-1, 1)d by a bubble function and simultaneously, to significantly reduce the number of interpolation points. We rigorously establish that with a proper choice of the bubble function, the resulting function has bounded mixed derivatives up to a certain order, which provides theoretical underpinnings for the use of sparse grids. Numerical experiments for American arithmetic and geometric basket put options with the number of underlying assets up to 16 are presented to validate the effectiveness of our approach.",2025
Deep Learning Based Grapevine Leaf Classification Using Augmented Images and Multi-Classifier Fusion for Improved Accuracy and Precision,"Grapevines mainly produce grapes, which can be enjoyed fresh or processed. Grapevine leaves are also collected annually as a secondary product, with their variety impacting both pricing and flavor. This research utilizes Deep Learning techniques to classify grapevine leaves based on images. Initially, 500 images of vine leaves representing five species are captured using a unique self-illumination system. Data augmentation methods expand the dataset to 2500 images. Classification is conducted using a modern CNN model, specifically fine-tuned MobileNetv2. Data preparation involves training the dataset with three classifiers: basic CNN, VGG19, and MobileNet. Image processing converts the RGBA dataset into RGB format. The dataset is split into three subsets: 70% for training, 20% for validation, and 10% for testing. Model preparation offers three options for selecting the appropriate architecture: Simple CNN, VGG19, and Transfer Learning with MobileNet. Model analysis assesses performance using key metrics and visualizations, achieving an accuracy of 96% with Adam optimizer and 88% with Stochastic Gradient Descent.",2024
Investor sentiment and machine learning: Predicting the price of China's crude oil futures market,"Sentiment analysis technology has made it possible to precisely calculate the daily reactions and opin-ions of investors, which has been found to have a significant influence on financial asset pricing. Thus, in this study, we examine the impacts that predictive power investor sentiment has over the price of China's crude oil. We first constructed investor sentiment indexes of China's crude oil futures based on specific economic variables and comments found on one of the most active online financial forums. Then, five popular machine learning tools were utilized to generate predictions. According to our findings, the long short-term memory model combined with the composite sentiment index performed the best due to a lower rate of prediction errors and greater directional accuracy for time-series forecasting of one-day-ahead prices. In this way, this study could aid researchers to more effectively investigate the en-ergy sector which is rapidly changing and highly speculative in nature (c) 2022 Elsevier Ltd. All rights reserved.",2022
Option Pricing Based on the Residual Neural Network,"We employ an innovative deep learning method to price options quickly and accurately. Specifically, we construct the Residual Neural Network model (ResNet) by two different basic residual blocks with three one-dimensional convolution layers and a shortcut. This model is a generalized option pricing method, and it can be used to approximate the option pricing formula without any assumptions. Besides, the model also can be easily extended to the deep ResNet model to achieve higher prediction accuracy. Comprehensive numerical experiments show that the deep ResNet model has excellent performance in the pricing of 50ETF options in the Chinese market, and the prediction accuracy of our model is higher than that of commonly used deep learning models, including deep neural network (DNN) and fully convolutional networks (FCN).",2024
Solving high-dimensional optimal stopping problems using deep learning,"Nowadays many financial derivatives, such as American or Bermudan options, are of early exercise type. Often the pricing of early exercise options gives rise to high-dimensional optimal stopping problems, since the dimension corresponds to the number of underlying assets. High-dimensional optimal stopping problems are, however, notoriously difficult to solve due to the well-known curse of dimensionality. In this work, we propose an algorithm for solving such problems, which is based on deep learning and computes, in the context of early exercise option pricing, both approximations of an optimal exercise strategy and the price of the considered option. The proposed algorithm can also be applied to optimal stopping problems that arise in other areas where the underlying stochastic process can be efficiently simulated. We present numerical results for a large number of example problems, which include the pricing of many high-dimensional American and Bermudan options, such as Bermudan max-call options in up to 5000 dimensions. Most of the obtained results are compared to reference values computed by exploiting the specific problem design or, where available, to reference values from the literature. These numerical results suggest that the proposed algorithm is highly effective in the case of many underlyings, in terms of both accuracy and speed.",2021
Option pricing mechanisms driven by backward stochastic differential equations,"This study investigates an option pricing method called g-pricing based on backward stochastic differential equations combined with deep learning. We adopted a data-driven approach to find a market-appropriate generator of the backward stochastic differential equation, which is achieved by leveraging the universal approximation capabilities of neural networks. Option pricing, which is the solution to the equation, is approximated using a recursive procedure. The empirical results for the S&P 500 index options show that the proposed deep learning g-pricing model has lower absolute errors than the classical Black-Scholes-Merton model for the same forward stochastic differential equations. The g-pricing mechanism has potential applications in option pricing.",2025
Application of deep learning to option hedging strategy,"The emergence of the digital information age has sparked considerable interest in predictive analytics within the realm of finance. Predicting uncertainty lies at the heart of Financial Engineering, where crafting investment or trading strategies using suitable prediction methods can optimize profits. This paper provides a novel work that approves the application of computer deep learning neural network has ability to predict volatility of the BlackScholes model and its derivatives. Employing a data-driven methodology, deep learning neural networks are utilized for volatility prediction, investigating their potential to enhance the accuracy of stock volatility forecasts and options pricing. Subsequently, the forecasted outcomes are leveraged for designing and executing hedging strategies, leading to the creation of three delta hedging approaches based on the anticipated stock volatility. The effectiveness of deep learning neural networks in volatility prediction is demonstrated, showcasing their ability to dynamically capture volatility shifts and outperform traditional models in forecasting accuracy.",2024
An Optimized Hybrid Model for Price Deviation Evaluation based on Neural Network,"As a strong displaying approach, neural networks have been broadly utilized in finance and financial forecasting. Scientific and fair trading-type open-end index fund (ETF) option pricing is favorable to maximizing the risk hedging function of the ETF, but it is also a sophisticated modelling procedure that necessitates a thorough understanding of market laws and economic importance. Based on China SSE 50 ETF, Harvest CSI 300 ETF, and high-frequency option data of 300ETF from Berry, this paper proposes another hybrid modelling method that consolidates the settled long-short-term memory neural network model (NLSTM) with the Heston model to acknowledge dynamic rectification of ETF choice price deviations. The research results show that the volatility characteristics of different types of ETF option prices are significantly different. Whether it is based on the BS pricing model or the Heston pricing model, it is difficult to accurately describe the complex changes in ETF option prices. By combining the NLSTM neural network model with the Heston model, it can effectively capture the dynamic changes of different types of ETF options, thereby improving the accuracy of ETF option pricing.",2023
Deep learning of optimal exercise boundaries for American options,"Efficiently determining a price and optimal exercise boundary for an American option is a critical subject in the financial sector. This study introduces a novel application of long short-term memory neural networks to solve a relevant Volterra equation, enhancing the accuracy and efficiency of American option pricing. The proposed approach outperforms traditional numerical techniques, including finite difference methods, binomial trees, and Monte Carlo methods, delivering an impressive speed improvement by a factor of thousands while maintaining industry-accepted accuracy levels. It exhibits computational speeds up to about a hundred times faster than the state-of-the-art method used by Andersen et al. [High-performance American option pricing, J. Comput. Finance 20(1) (2016), pp. 39-87] when evaluating numerous options. The proposed network, trained on a reasonable range of parameters related to the Black-Scholes model, swiftly determines option prices and exercise boundaries, serving as a practical closed-form solution.",2025
Deep Learning in Model Risk Neutral Distribution for Option Pricing,"Option pricing has been studied extensively in recent years. An important issue in option pricing is the estimation of the risk neutral distribution of an underlying asset. Better estimation of this distribution can lead to a more rational investment, enabling one to earn an equal return with lower risk. To price options precisely and correctly, traditional financial engineering methods make some assumptions for the risk neutral distribution. However, some assumptions of traditional methods have proved inappropriate and insufficient in empirical option pricing analysis. To address these problems in option pricing, this study adopts a data-driven approach. Owing to advances in hardware and software, studies have been using deep learning methods to price options; however, these have not adequately considered the risk neutral distribution. This may cause an uncontrollable risk, thereby preventing the real-world application of the model. To overcome these problems, this study proposes a deep learning method with a mixture distribution model. Further, it generates a rational risk neutral distribution with accurate empirical pricing analysis.",2019
Pricing exotic derivatives exploiting structure,"In this paper we introduce a new fast and accurate numerical method for pricing exotic derivatives when discrete monitoring occurs, and the underlying evolves according to a Markov one-dimensional stochastic processes. The approach exploits the structure of the matrix arising from the numerical quadrature of the pricing backward formulas to devise a convenient factorization that helps greatly in the speed-up of the recursion. The algorithm is general and is examined in detail with reference to the CEV (Constant Elasticity of Variance) process for pricing different exotic derivatives, such as Asian, barrier, Bermudan, lookback and step options for which up to date no efficient procedures are available. Extensive numerical experiments confirm the theoretical results. The MATLAB code used to perform the computation is available online at http://www1.mate.polimi.it/similar to marazzina/BP.htm. (C) 2013 Elsevier B.V. All rights reserved.",2014
