Article Title,Abstract,Publication Year
The Study on Option Pricing Based on Wiener-Itô Chaos Expansion and Generative Adversarial Networks,"The stochastic volatility model, for pricing complex financial products, adequately considers the skewness and smile shape of asset volatility. However, it is often challenging to obtain analytical solutions for options on asset prices under such models. Therefore, this study proposes a hybrid approach for forecasting the prices of European options based on the Heston model, utilizing the Wiener-It & ocirc; chaos (WIC) expansion and generative adversarial networks (GANs). Firstly, a two-step approach is constructed based on the simulated annealing algorithm and trust region reflective algorithm to globally optimize the Heston model. Secondly, the WIC method is adopted to derive a closed-form approximate pricing formula for European call options under the mixed volatility model, which in turn yields an approximation of option prices under the Heston model. Thirdly, the GANs model, incorporating long short-term memory networks and multi-layer perceptrons, is utilized to train the residual term D, representing the difference between the actual option price and its asymptotic approximation, which substantially improves the forecasting model's accuracy and robustness. Empirical research on SSE 50 ETF options demonstrates that the proposed model achieves better results in terms of accuracy and stability. The empirical results of training the residual term D significantly outperform those of training the actual option price. Additionally, the adversarial game concept of the GANs model leads to significantly better forecast performance compared to other machine learning models.",2024
DeepOption: A novel option pricing framework based on deep learning with fused distilled data from multiple parametric methods,"The remarkable performance of deep learning is based on its ability to learn high-level features by processing large amounts of data. This exceptionally superior performance has attracted the attention of researchers studying option pricing. However, option data are more expensive and less accessible than other types of data and are imbalanced because of the liquidity of options. This motivated us to propose a new option pricing and delta-hedging framework called DeepOption. This framework, which is based on deep learning, can improve the performance even when applying imbalanced real option data. In particular, the framework fuses simulated big data, known as distilled data, obtained using various traditional parametric methods. The proposed model employs the following three-stage training approach: Our model is pre-trained using big distilled data after it is finetuned using real option data through transfer learning. Finally, a delta branch is added to the model and trained. We experimentally evaluated the proposed method using three sets of real option data, namely S&P 500 European call options, EuroStoxx50 call options, and Hang Seng Index put options. Our experimental results on option pricing demonstrate that our proposed model outperforms parametric methods and other machine learning methods. Specifically, our model, which uses pre-training with distilled data, reduces the overall mean absolute percentage error (MAPE) by more than 50%, compared with that of a deep learning model using only real option data without pre-training.",2021
Pricing options with a new hybrid neural network model,"A novel hybrid option pricing model using a deep learning neural network has been developed. The hybrid model keeps the traditional option pricing model with the same input parameters while simultaneously adjusting the model with neural network methods to improve accuracy when applied to real market data, especially in OTM options. The new hybrid model demonstrates superior accuracy compared to both traditional parametric and non-parametric option pricing models for both Call and Put options across all moneyness levels. The empirical results of the hybrid model provide an explanation for the deviation from the Put-Call parity observed in real market data.",2024
A novel recurrent neural network based prediction system for trading,"To reduce their exposure to price fluctuations in the markets, traders are increasingly dealing with options and other derivative securities. There is thus a need to address the limitations of traditional parametric pricing methods, which rely on assumptions to capture the complex dynamics of price processes. This paper proposes a novel non-parametric method using a recurrent neural network for estimating the future prices of commodities such as gold and currencies. The price predictions, shown to be accurate and computationally efficient, are used in a hedging system to avoid unnecessary risks. Experiments show that the trading system can, when using the proposed network and strategy, form portfolios yielding a return on investment of nearly 5%.",2006
Deep Curve-Dependent PDEs for Affine Rough Volatility,"We introduce a new deep learning--based algorithm to evaluate options in affine rough stochastic volatility models. Viewing the pricing function as the solution to a curve-dependent PDE, depending on forward curves rather than the whole path of the process, we develop a numerical scheme based on deep learning techniques. Numerical simulations suggest that the latter is a promising alternative to classical Monte Carlo simulations.",2023
Empirical of the Taiwan stock index option price forecasting model - applied artificial neural network,"This work presents a novel neural network model for forecasting option prices using past volatilities and other options market factors. Out of different approaches to estimating volatility in the option pricing model, this study uses backpropagation neural network to forecast prices for Taiwanese stock index options. The ability to develop accurate forecasts of grey prediction volatility enables practitioners to establish an appropriate hedging strategy at in-the-money option.",2009
Meshless methods for American option pricing through Physics-Informed Neural Networks,"Nowadays, Deep Learning is drastically revolutionizing financial research as well as industry. Many methods have been discussed in the last few years, mainly related to option pricing. In fact, traditional approaches such as Monte Carlo simulation or finite difference methods are seriously harmed by multi-dimensional underlying and path dependency. Thus, dealing with particular contracts such as American multi-asset options is still rough. This paper addresses such a problem by pricing said put options with a novel meshless methodology, named Physics-Informed Neural Networks (PINNs), based on Artificial Intelligence. PINN paradigm has been recently introduced in Deep Learning literature. It exploits the theoretical background of the universal approximation theorem for neural networks to solve Partial Differential Equations numerically. This Deep Learning meshless method incorporates the equation and its initial and boundary conditions thanks to a specially designed loss function. We develop a suitable PINN for the proposed problem by introducing an algorithmic trick for improving the convergence of the free boundary problem. Furthermore, the worthiness of the proposal is assessed by several experiments concerned with single and multi-asset options. Finally, a parametric model is built to benefit further studies of option value behaviour related to particular market conditions.",2023
Pricing high-dimensional Bermudan optionsusing deep learning and higher-order weakapproximation,"This paper proposes a new deep-learning-based algorithm for high-dimensionalBermudan option pricing. To the best of our knowledge, this is the first study ofthe arbitrary-order discretization scheme in Bermudan option pricing or dynamicprogramming problems. By discretizing the interval between early-exercise datesusing a higher-order weak approximation of stochastic differential equations, it ispossible to accurately approximate the price of Bermudan options. In particular,we provide the theoretical rate of convergence for the discretization of a Bermudanoption price by utilizing the error analysis of the weak approximation of stochas-tic differential equations for the case of irregular payoff functions. This high-performance deep-learning method permits the conditional expectations appearingin Bermudan option pricing to be estimated quickly even if the dimension is high The new approximation scheme is an alternative to the least squares regressionmethod. Numerical examples for Bermudan option pricing in high-dimensional set-tings (including a 100-dimensional stochastic alpha-beta-rho model) demonstratethe validity of the proposed scheme",2024
Deep Learning and American Options via Free Boundary Framework,"We propose a deep learning method for solving the American options model with a free boundary feature. To extract the free boundary known as the early exercise boundary from our proposed method, we introduce the Landau transformation. For efficient implementation of our proposed method, we further construct an implicit dual solution framework consisting of a novel auxiliary function and free boundary equations. The auxiliary function is formulated to include the feed-forward deep neural network (DNN) output and further mimic the far boundary behaviour, smooth pasting condition, and remaining boundary conditions due to the second-order space derivative and first-order time derivative. Because the early exercise boundary and its derivative are not a priori known, the boundary values mimicked by the auxiliary function are in approximate form. Concurrently, we then establish equations that approximate the early exercise boundary and its derivative directly from the DNN output based on some linear relationships at the left boundary. Furthermore, the option Greeks are obtained from the derivatives of this auxiliary function. We test our implementation with several examples and compare them with the existing numerical methods. All indicators show that our proposed deep learning method presents an efficient and alternative way of pricing options with early exercise features.",2024
Deep Learning Artificial Neural Network for Pricing Multi-Asset European Options,"This paper studies a p-layers deep learning artificial neural network (DLANN) for European multi-asset options. Firstly, a p-layers DLANN is constructed with undetermined weights and bias. Secondly, according to the terminal values of the partial differential equation (PDE) and the points that satisfy the PDE of multi-asset options, some discrete data are fed into the p-layers DLANN. Thirdly, using the least square error as the objective function, the weights and bias of the DLANN are trained well. In order to optimize the objective function, the partial derivatives for the weights and bias of DLANN are carefully derived. Moreover, to improve the computational efficiency, a time-segment DLANN is proposed. Numerical examples are presented to confirm the accuracy, efficiency, and stability of the proposed p-layers DLANN. Computational examples show that the DLANN's relative error is less than 0.5% for different numbers of assets d=1,2,3,4. In the future, the p-layers DLANN can be extended into American options, Asian options, Lookback options, and so on.",2025
A novel recurrent neural network-based prediction system for option trading and hedging,"In order to reduce their exposure to the erratic fluctuations of the financial markets, traders are nowadays increasingly dealing with options and other derivative securities instead of directly trading in the underlying assets. This paradigm shift has attracted the attention of many researchers, and there has been a tremendous increase in the awareness and activities of derivative securities. In particular there is a need to devise new techniques to address the limitations of traditional parametric pricing methods, which rely on assumptions and approximations to capture the complex dynamics of pricing processes. This paper proposes a novel non-parametric method using an ad-hoc recurrent neural network for estimating the future prices of war commodities such as gold and crude oil as well as currencies, which are increasingly gaining importance in the financial markets. The price predictions from the network, shown to be accurate and computationally efficient, are used in a hedging system to avoid unnecessary risks. Experiments with actual gold and currency trading data show that our system using the proposed network and strategy can construct portfolios yielding a return on investment of about 4.76%.",2008
Deep joint learning valuation of Bermudan swaptions,"This paper addresses the problem of pricing involved financial derivatives by means of advanced deep learning techniques. More precisely, we methodically integrate several sophisticated neural network-based concepts like differential machine learning, Monte Carlo simulation-like training samples and joint learning to come up with an efficient numerical solution. The application of the latter development represents a novelty in the context of computational finance. We also propose a novel design of interdependent neural networks to price early-exercise products, in this case, Bermudan swaptions. The improvements in efficiency and accuracy provided by the approach proposed here are widely illustrated throughout a range of numerical experiments. Moreover, this novel methodology can be extended to the pricing of other financial derivatives.",2025
A Novel Bitcoin and Gold Prices Prediction Method Using an LSTM-P Neural Network Model,"As a result of the fast growth of financial technology and artificial intelligence around the world, quantitative algorithms are now being employed in many classic futures and stock trading, as well as hot digital currency trades, among other applications today. Using the historical price series of Bitcoin and gold from 9/11/2016 to 9/10/2021, we investigate an LSTM-P neural network model for predicting the values of Bitcoin and gold in this research. We first employ a noise reduction approach based on the wavelet transform to smooth the fluctuations of the price data, which has been shown to increase the accuracy of subsequent predictions. Second, we apply a wavelet transform to diminish the influence of high-frequency noise components on prices. Third, in the price prediction model, we develop an optimized LSTM prediction model (LSPM-P) and train it using historical price data for gold and Bitcoin to make accurate predictions. As a consequence of our model, we have a high degree of accuracy when projecting future pricing. In addition, our LSTM-P model outperforms both the conventional LSTM models and other time series forecasting models in terms of accuracy and precision.",2022
Option Pricing Based on GA-BP neural network,"Machine Learning has received widespread attention in the financial field, especially in the issue of option pricing. Compared with the original BSM (Black-Scholes-Merton) option pricing method, this paper introduces the genetic algorithm into the option pricing process based on the characteristics of financial data, and constructs a GA-BP neural network (Neural Networks) option pricing Model and empirical analysis of European call options based on the Shanghai and Shenzhen 300 Index. The research results show that the option price calculation result of the GA-BP neural network algorithm has better accuracy than the BP neural network model or the classic BSM method, while taking into account efficiency, which is helpful to predicting option prices in financial practice to a certain extent. (C) 2021 The Authors. Published by Elsevier B.V.",2022
Numerical solving of generalized Black-Scholes differential equation using deep learning based on blocked residual connection,"Option pricing in the financial derivatives market is worth studying. When the volatility and the rate of return are not fixed in Blacks-Scholes (BS) equation, the analytical form of the solution is difficult to be obtained. In this paper, we propose deep learning based on blocked residual connection method (DLBR) for the numerical solving of BS equations. The validity period and inventory price are the inputs of the network, while the option price is the solution. Neurons on the multiple hidden layers are processed in blocks and each block is connected to the residuals. The boundary conditions are constructed as a part of the numerical solution and the loss function is minimized to obtain the optimal network parameters. The DLBR method has strong applicability and overcomes the shortcomings of extreme learning machines. Three experiment calculated the numerical solution of the BS equation about European options and promoted the option pricing model. Compared with the existing algorithms such as finite element method and physics-informed neural networks (PINN) method, the obtained numerical solution has higher precision and smaller error, which shows the feasibility and superiority of the proposed method. (C) 2022 Elsevier Inc. All rights reserved.",2022
On pricing of discrete Asian and Lookback options under the Heston model,"We propose a new, data-driven approach for efficient pricing of - fixed- and floating-strike - discrete arithmetic Asian and Lookback options when the underlying process is driven by the Heston model dynamics. The method proposed in this article constitutes an extension of Perotti and Grzelak [Fast sampling from time-integrated bridges using deep learning, J. Comput. Math. Data Sci. 5 (2022)], where the problem of sampling from time-integrated stochastic bridges was addressed. The model relies on the Seven-League scheme [S. Liu et al. The seven-league scheme: Deep learning for large time step Monte Carlo simulations of stochastic differential equations, Risks 10 (2022), p. 47], where artificial neural networks are employed to 'learn' the distribution of the random variable of interest utilizing stochastic collocation points [L.A. Grzelak et al. The stochastic collocation Monte Carlo sampler: Highly efficient sampling from expensive distributions, Quant. Finance 19 (2019), pp. 339-356]. The method results in a robust procedure for Monte Carlo pricing. Furthermore, semi-analytic formulae for option pricing are provided in a simplified, yet general, framework. The model guarantees high accuracy and a reduction of the computational time up to thousands of times compared to classical Monte Carlo pricing schemes.",2024
Instantaneous and Averaged Volatility in Two-Side Filtration Model of Financial Asset Pricing,"A two-factor approach to asset pricing based on averaged historical and instantaneous volatility defined by a marginal investor's beliefs and herding behaviour is proposed. For the two-side filtration, backward SDE-defined stochastic dynamics under the risk-neutral probability measure are determined by a target price distribution at given horizon with parameters averaged over a subset of active market agents. For the current price at market equilibrium and instantaneous volatility, the distribution of acceptable price of risk is obtained. The found implied volatility dependencies on strike and maturity are corresponding to the historical data for options by Carr and Wu (2016). The liquidity discount for bonds and options is derived. A generalized solution for the FBSDE and a partial solution for the stochastic terminal conditions are found. The developed two-factor approach is well-suited to deep learning pricing algorithms.",2023
Improving neural network based option price forecasting,"As is widely known, the popular Black & Scholes model for option pricing suffers from systematic biases, as it relies on several highly questionable assumptions. In this paper we study the ability of neural networks (MLPs) in pricing call options on the S&P 500 index; in particular we investigate the effect of the hidden neurons in the in- and out-of-sample pricing. We modify the Black & Scholes model given the price of an option based on the no-arbitrage value of a forward contract, written on the same underlying asset, and we derive a modified formula that can be used for our purpose. Instead of using the standard backpropagation training algorithm we replace it with the Levenberg-Marquardt approach. By modifying the objective function of the neural network, we focus the learning process on more interesting areas of the implied volatility surface. The results from this transformation are encouraging.",2006
Improved BP Neural Network and Its Application in Real Option Pricing,"In recent years, many overseas and domestic experts had paid attention to research on options pricing. But these methods could not get rid of the subjectivity and fuzzy qualities existing in pricing process, and the accuracy of assessed results had not quite improved. It will be very helpful to investors, if we could set up an objective scientific real option pricing method. The paper researches on an improved BP artificial neural network model and its appliance in the investment decision-making.",2008
Artificial Neural Networks Performance in WIG20 Index Options Pricing,"In this paper, the performance of artificial neural networks in option pricing was analyzed and compared with the results obtained from the Black-Scholes-Merton model, based on the historical volatility. The results were compared based on various error metrics calculated separately between three moneyness ratios. The market data-driven approach was taken to train and test the neural network on the real-world options data from 2009 to 2019, quoted on the Warsaw Stock Exchange. The artificial neural network did not provide more accurate option prices, even though its hyperparameters were properly tuned. The Black-Scholes-Merton model turned out to be more precise and robust to various market conditions. In addition, the bias of the forecasts obtained from the neural network differed significantly between moneyness states. This study provides an initial insight into the application of deep learning methods to pricing options in emerging markets with low liquidity and high volatility.",2022
A new deep neural network algorithm for multiple stopping with applications in options pricing,"In this paper, we propose a deep learning method to solve high-dimensional optimal multiple stopping problems. We represent the policies of multiple stopping problems by the composition of functions. Using the new representation, we approximate the optimal stopping policy recursively with simulation samples. We also derive lower and upper bounds and confidence intervals for the values. Finally, we apply the algorithm to the pricing of swing options, and it produces accurate results in high-dimensional problems.(c) 2022 Elsevier B.V. All rights reserved.",2023
Artificial neural network for option pricing with and without asymptotic correction,"This paper proposes a mixed approach of asymptotic expansion (AE) and artificial neural network (ANN) methods for option pricing in order to improve computational speed, stability, and approximation accuracy. In practice, there is wide use of complex stochastic volatility models (SVMs) which can allow for skew and smile shapes. However, under these models, it is usually hard to obtain analytical solutions for options written on the asset price. AE can compute option prices and their sensitivities effectively, but it can usually only compute a finite sum of terms of the complete solution because, as the expansion order increases, both analytical and numerical calculations become tedious and messy and the computational cost grows exponentially. On the other hand, using ANN one can separate the pricing procedure into two steps: (1) approximating ANN that can be trained offline and (2) using the ANN predicted option price obtained online. The offline procedure has an extremely high-computational cost because it requires tens to hundreds of thousands of Monte Carlo (MC) or PDE numerical simulations in order to train several hidden layers and several dozens of nodes. Moreover, deep learning (DL) for option pricing shows unstable behaviour and poor quality because the sensitivity of the derivatives price with respect to the input often takes a bell-shape, which induces rapid changes in value. By combining the strong points and making up for the weak points of the two methods, our new approach offers the following improvements: (1) much less training data, layers, and nodes are required: (2) the offline training becomes more robust and the online predictions produce more stable and accurate results: and (3) it significantly speeds up the offline calculations.",2021
