Article Title,Abstract,Publication Year
Study of Pricing of High-Dimensional Financial Derivatives Based on Deep Learning,"Many problems in the fields of finance and actuarial science can be transformed into the problem of solving backward stochastic differential equations (BSDE) and partial differential equations (PDEs) with jumps, which are often difficult to solve in high-dimensional cases. To solve this problem, this paper applies the deep learning algorithm to solve a class of high-dimensional nonlinear partial differential equations with jump terms and their corresponding backward stochastic differential equations (BSDEs) with jump terms. Using the nonlinear Feynman-Kac formula, the problem of solving this kind of PDE is transformed into the problem of solving the corresponding backward stochastic differential equations with jump terms, and the numerical solution problem is turned into a stochastic control problem. At the same time, the gradient and jump process of the unknown solution are separately regarded as the strategy function, and they are approximated, respectively, by using two multilayer neural networks as function approximators. Thus, the deep learning-based method is used to overcome the curse of dimensionality caused by high-dimensional PDE with jump, and the numerical solution is obtained. In addition, this paper proposes a new optimization algorithm based on the existing neural network random optimization algorithm, and compares the results with the traditional optimization algorithm, and achieves good results. Finally, the proposed method is applied to three practical high-dimensional problems: Hamilton-Jacobi-Bellman equation, bond pricing under the jump Vasicek model and option pricing under the jump diffusion model. The proposed numerical method has obtained satisfactory accuracy and efficiency. The method has important application value and practical significance in investment decision-making, option pricing, insurance and other fields.",2023
Deep weighted Monte Carlo: a hybrid option pricing framework using neural networks,"Recent studies have demonstrated the efficiency of Variational Autoencoders (VAE) to compress high-dimensional implied volatility surfaces into a low dimensional representation. Although this method can be effectively used for pricing vanilla options, it does not provide any explicit information about the dynamics of the underlying asset. In our work we present an effective way to overcome this problem. We use a Weighted Monte Carlo approach to first generate paths from a simple a priori Brownian dynamics, and then calculate path weights to price options correctly. We develop and successfully train a neural network that is able to assign these weights directly from the latent space. Combining the encoder network of the VAE and this new weight assigner module, we are able to build a dynamic pricing framework which cleanses the volatility surface from irrelevant noise fluctuations, and then can price not just vanillas, but also exotic options on this idealized vol surface. This pricing method can provide relative value signals for option traders.Key findings of the paper: We confirmed the success of Variational Autoencoders in compressing volatility surfaces into low dimensional latent spaces in the swaption market.We successfully extracted the physically meaningful information from the latent representation of the market by translating the latent coordinates into weights of Monte Carlo paths.We developed a hybrid approach by combining Deep Learning and Weighted Monte Carlo that can price any type of option consistently with the latent model represented by the fully trained VAE.",2023
Deep Local Volatility,"Deep learning for option pricing has emerged as a novel methodology for fast computations with applications in calibration and computation of Greeks. However, many of these approaches do not enforce any no-arbitrage conditions, and the subsequent local volatility surface is never considered. In this article, we develop a deep learning approach for interpolation of European vanilla option prices which jointly yields the full surface of local volatilities. We demonstrate the modification of the loss function or the feed forward network architecture to enforce (hard constraints approach) or favor (soft constraints approach) the no-arbitrage conditions and we specify the experimental design parameters that are needed for adequate performance. A novel component is the use of the Dupire formula to enforce bounds on the local volatility associated with option prices, during the network fitting. Our methodology is benchmarked numerically on real datasets of DAX vanilla options.",2020
Stock Volatility Forecast Base on Comparative Learning and Autoencoder Framework,"Volatility is an important indicator of derivatives pricing, financial risk measurement, and market panic sentiment measurement. A reasonable prediction of volatility is of great significance to market participants and regulators. This article proposes a new volatility forecast model. We use comparative learning and autoencoders to improve the accuracy and robustness of the model. Reduce the instability of financial data due to noise. And this article expands traditional machine learning research methods. The traditional model is compared with other deep learning models. Our model has made very competitive progress in accuracy and loss compared to other models.",2022
Learning the random variables in Monte Carlo simulations with stochastic gradient descent: Machine learning for parametric PDEs and financial derivative pricing,"In financial engineering, prices of financial products are computed approximately many times each trading day with (slightly) different parameters in each calculation. In many financial models such prices can be approximated by means of Monte Carlo (MC) simulations. To obtain a good approximation the MC sample size usually needs to be considerably large resulting in a long computing time to obtain a single approximation. A natural deep learning approach to reduce the computation time when new prices need to be calculated as quickly as possible would be to train an artificial neural network (ANN) to learn the function which maps parameters of the model and of the financial product to the price of the financial product. However, empirically it turns out that this approach leads to approximations with unacceptably high errors, in particular when the error is measured in the L infinity-norm, and it seems that ANNs are not capable to closely approximate prices of financial products in dependence on the model and product parameters in real life applications. This is not entirely surprising given the high-dimensional nature of the problem and the fact that it has recently been proved for a large class of algorithms, including the deep learning approach outlined above, that such methods are in general not capable to overcome the curse of dimensionality for such approximation problems in the L infinity-norm. In this article we introduce a new numerical approximation strategy for parametric approximation problems including the parametric financial pricing problems described above and we illustrate by means of several numerical experiments that the introduced approximation strategy achieves a very high accuracy for a variety of high-dimensional parametric approximation problems, even in the L infinity-norm. A central aspect of the approximation strategy proposed in this article is to combine MC algorithms with machine learning techniques to, roughly speaking, learn the random variables (LRV) in MC simulations. In other words, we employ stochastic gradient descent (SGD) optimization methods not to train parameters of standard ANNs but instead to learn random variables appearing in MC approximations. In that sense, the proposed LRV strategy has strong links to Quasi-Monte Carlo (QMC) methods as well as to the field of algorithm learning. Our numerical simulations strongly indicate that the LRV strategy might indeed be capable to overcome the curse of dimensionality in the L infinity-norm in several cases where the standard deep learning approach has been proven not to be able to do so. This is not a contradiction to the established lower bounds mentioned above because this new LRV strategy is outside of the class of algorithms for which lower bounds have been established in the scientific literature. The proposed LRV strategy is of general nature and not only restricted to the parametric financial pricing problems described above, but applicable to a large class of approximation problems. In this article we numerically test the LRV strategy in the case of the pricing of European call options in the Black-Scholes model with one underlying asset, in the case of the pricing of European worst-of basket put options in the Black-Scholes model with three underlying assets, in the case of the pricing of European average put options in the Black-Scholes model with three underlying assets and knock-in barriers, as well as in the case of stochastic Lorentz equations. For these examples the LRV strategy produces highly convincing numerical results when compared with standard MC simulations, QMC simulations using Sobol sequences, SGD-trained shallow ANNs, and SGD-trained deep ANNs.",2024
Forecasting and trading currency volatility: An application of recurrent neural regression and model combination,"In this paper, we examine the use of non-parametric Neural Network Regression (NNR) and Recurrent Neural Network (RNN) regression models for forecasting and trading currency volatility, with an application to the GBP/USD and USD/JPY exchange rates. Both the results of the NNR and RNN models are benchmarked against the simpler GARCH alternative and implied volatility. Two simple model combinations are also analysed. The intuitively appealing idea of developing a nonlinear nonparametric approach to forecast FX volatility, identify mispriced options and subsequently develop a trading strategy based upon this process is implemented for the first time on a comprehensive basis. Using daily data from December 1993 through April 1999, we develop alternative FX volatility forecasting models. These models are then tested out-of-sample over the period April 1999-May 2000, not only in terms of forecasting accuracy, but also in terms of trading efficiency: in order to do so, we apply a realistic volatility trading strategy using FX option straddles once mispriced options have been identified. Allowing for transaction costs, most trading strategies retained produce positive returns. RNN models appear as the best single modelling approach yet, somewhat surprisingly, model combination which has the best overall performance in terms of forecasting accuracy, fails to improve the RNN-based volatility trading results. Another conclusion from our results is that, for the period and currencies considered, the currency option market was inefficient and/or the pricing formulae applied by market participants were inadequate. Copyright (C) 2002 John Wiley Sons, Ltd.",2002
Some Computational Methods in Finance,"Partial Differential Equations (PDE) and Partial Integro-Differential Equations (PIDE) play a major role in financial mathematics and provide a powerful and consistent framework for pricing complex financial derivatives. However, since closedform solutions are not available in general, numerical methods are often used. The article considers financial models based on exponential Levy processes, the PIDE derived from the models and different computational methods for solving these PIDE. A proposal for using Cellular Neural Networks (CNN) for solving PIDE is presented.",2021
How Can We Train Deep Learning Models Across Clouds and Continents? An Experimental Study,"This paper aims to answer the question: Can deep learning models be cost-efficiently trained on a global market of spot VMs spanning different data centers and cloud providers? To provide guidance, we extensively evaluate the cost and throughput implications of training in different zones, continents, and clouds for representative CV, NLP and ASR models. To expand the current training options further, we compare the scalability potential for hybrid-cloud scenarios by adding cloud resources to on-premise hardware to improve training throughput. Finally, we show how leveraging spot instance pricing enables a newcost-efficient way to train models with multiple cheap VMs, trumping both more centralized and powerful hardware and even on-demand cloud offerings at competitive prices.",2024
Deep Learning Approach for Prognoses of Long-Term Options Behavior,"Since the inception of asset pricing models, starting as far back as beginning of XX century, and moreover after the fundamental work of Black and Scholes (1973), there has been considerable interest in analytical research of stock exchange equities behavior. Still up to nowadays it remains a critical task for participants engaged in the field of financial mathematics. The reason of such an undying interest is that to adequately assess investments risks the stock exchange actors (brokers, investors, traders, et. al) need still more and more accurate prediction results obtained as fast as possible. It is a matter of fact proven by numerous researchers that assets derivatives behave differently being observed in small, medium, and long-term frames. Algorithms for predicting the dynamics of stock options and other assets derivatives for both small times (where one plays on market fluctuations), and medium ones (where trade is stressed at the beginning and closing moments) are well developed, and trading robots are actively used for these purposes. Analysis of the dynamics of assets for very long time-frames (of order of several months and years) is still beyond the scope of analysts as it is expensively prohibited, although this issue is extremely important for hedging the investments portfolios. The present paper focuses on construction of an effective and resourceintensive model for predicting the behavior of financial instruments, trends and price movements based upon the principles of deep learning. The forecasts obtained by the model showed an almost acceptable compliance with the true prices of the S&P500.",2019
Deep learning for derivatives pricing: a comparative study of asymptotic and quasi-process corrections,"In this study, we compare two methods for using neural networks to efficiently learn the price of derivatives. The first method, proposed by Funahashi (Quant Financ 21(4):575-592, 2021a), involves training the neural networks to learn the difference between the derivative price and its asymptotic expansion, rather than learning the derivative price directly. The target derivative price is then obtained by adding the approximate solution with the predicted value of neural networks. This method reduces the required amount of learning data, often by a factor of one hundred to one thousand, compared to the case where the derivative price is directly learned through neural networks. In the second method, established in this paper, the neural networks learn the difference between the derivative price written on the underlying asset price that follows the target complex stochastic process and the derivative price written on the underlying asset price that has a relatively simple stochastic process that has a closed-form solution for the target derivative prices. This method provides an alternative valuation method when no efficient approximate solution for the derivative value is observed and if one can arbitrarily determine the model parameters of the quasi-process that approximates the original process. We also propose a unified method to determine the model parameters of quasi-processes from underlying asset processes. These methods prove valuable in cases where general analytic solutions are absent, as seen in widely used financial models such as the stochastic volatility models. These cases involve time-consuming numerical calculations to generate learning data, highlighting the value of the two methods, which significantly compress calculation times.",2024
Milk marketing policy options for the dairy industry in New England,"New England dairy farmers are under intense price pressure resulting from important growth in milk production from lower cost of production Southwest states as well as by retailers' market power. Agricultural officials and legislative bodies in New England and in other Northeast US states are aware of these pressures and have been reacting with emergency dairy farm aid, following a very low 2006 milk price, and with state legislations in an attempt to address perceived excess retailing margins for fluid milk. In this paper, we suggest that a sigmoid demand relationship exists for fluid milk. This demand relationship would explain fluid milk asymmetric price transmission, high-low pricing, and the creation of a large retailing margin (chain surplus) often observed for fluid milk. It is also argued that a sigmoid demand relationship offers an opportunity for state legislators to help Northeast dairy farmers capturing a larger share of the dollar of the consumers through various policy options. Therefore, 5 milk market channel regulatory mechanisms (status quo, price gouging, supply control, fair share policy, and chain surplus return) are discussed and compared. The supply control mechanism was found the most effective at redistributing the chain surplus, associated with the sigmoid demand relationship for fluid milk, to dairy farmers. However, this option is unlikely to be politically acceptable in the United States. Second-best options for increasing dairy farmers' share of the consumers' dollar are the fair price policy and the chain surplus return. The former mechanism would distribute the chain surplus between retailers, processors, and farmers, whereas the latter would distribute it between consumers, retailers, and farmers. Remaining mechanisms would either transfer the chain surplus to retailers (status quo) or to consumers (price gouging).",2008
Deep Learning for Options Trading: An End-To-End Approach,"We introduce a novel approach to options trading strategies using a highly scalable and data-driven machine learning algorithm. In contrast to traditional approaches that often require specifications of underlying market dynamics or assumptions on an option pricing model, our models depart fundamentally from the need for these prerequisites, directly learning non-trivial mappings from market data to optimal trading signals. Backtesting on more than a decade of option contracts for equities listed on the S&P 100, we demonstrate that deep learning models trained according to our end-to-end approach exhibit significant improvements in risk-adjusted performance over existing rules-based trading strategies. We find that incorporating turnover regularization into the models leads to further performance enhancements at prohibitively high levels of transaction costs.",2024
Stable Multilevel Deep Neural Networks for Option Pricing and xVAs Using Forward-Backward Stochastic Differential Equations,"Deep learning techniques have significantly impacted fields such as image processing, computer vision, and natural language processing. However, their influence on quantitative finance, particularly in option pricing, hedging, and portfolio management, has been limited. Traditional financial applications rely on rigorous mathematical models and established numerical methods like Monte Carlo and finite difference methods. However, these methods struggle with high-dimensional problems. Recent works propose using Deep Neural Networks (DNNs) to solve high-dimensional Partial Differential Equations (PDEs) in finance, potentially overcoming the limitations of conventional techniques. Despite the recent progress, DNN methods face high computational costs, stability issues, and generally fail to meet the high accuracy requirements of the financial industry. This paper addresses these challenges. To address the high computational cost of training deep neural networks for financial applications, we propose a multilevel architecture inspired by multilevel Monte Carlo methods. To enhance stability, we adopt a dynamical systems perspective and utilize the NAIS-Net architecture, which ensures global asymptotic stability. For improving accuracy, we leverage the forward and backward systems of stochastic differential equations (FBSDEs) for option pricing problems. We also provide a theoretical argument that suggests that the proposed approach is superior to Physics Informed Neural Networks. Finally, the proposed methodology is implemented on several option pricing and xVA problems and is shown to achieve higher efficiency and accuracy, notably improving the pricing of options and xVAs by an order of magnitude over state-of-the-art methods.",2024
Tensor Processing Units for Financial Monte Carlo,"Monte Carlo methods are critical to many routines in quantitative finance such as derivatives pricing, hedging and risk metrics. Unfortunately, Monte Carlo methods are very computationally expensive when it comes to running simulations in high-dimensional state spaces where they are still a method of choice in the financial industry. Recently, Tensor Processing Units (TPUs) have provided considerable speedups and decreased the cost of running Stochastic Gradient Descent (SGD) in Deep Learning. After highlighting computational similarities between training neural networks with SGD and simulating stochastic processes, we ask in the present paper whether TPUs are accurate, fast and simple enough to use for financial Monte Carlo. Through a theoretical reminder of the key properties of such methods and thorough empirical experiments we examine the fitness of TPUs for option pricing, hedging and risk metrics computation. In particular we demonstrate that, in spite of the use of mixed precision, TPUs still provide accurate estimators which are fast to compute when compared to GPUs. We also show that the Tensorflow programming model for TPUs is elegant, expressive and simplifies automated differentiation.",2020
CBI-time-changed Levy processes for multi-currency modeling,"We develop a stochastic volatility framework for modeling multiple currencies based on CBI-time-changed Levy processes. The proposed framework captures the typical risk characteristics of FX markets and is coherent with the symmetries of FX rates. Moreover, due to the self-exciting behavior of CBI processes, the volatilities of FX rates exhibit self-exciting dynamics. By relying on the theory of affine processes, we show that our approach is analytically tractable and that the model structure is invariant under a suitable class of risk-neutral measures. A semi-closed pricing formula for currency options is obtained by Fourier methods. We propose two calibration methods, also by relying on deep-learning techniques, and show that a simple specification of the model can achieve a good fit to market data on a currency triangle.",2024
Detecting asset price bubbles using deep learning,"In this paper, we employ deep learning techniques to detect financial asset bubbles by using observed call option prices. The proposed algorithm is widely applicable and model-independent. We test the accuracy of our methodology in numerical experiments within a wide range of models and apply it to market data of tech stocks in order to assess if asset price bubbles are present. Under a given condition on the pricing of call options under asset price bubbles, we are able to provide a theoretical foundation of our approach for positive and continuous stochastic asset price processes. When such a condition is not satisfied, we focus on local volatility models. To this purpose, we give a new necessary and sufficient condition for a process with time-dependent local volatility function to be a strict local martingale.",2025
Hodrick-Prescott filter-based hybrid ARIMA-SLFNs model with residual decomposition scheme for carbon price forecasting,"Accurate carbon pricing guidance is of great importance for the inhibition of excessive carbon dioxide emissions. Aiming at improving forecast performance, a number of carbon price forecasting models have been proposed based on the combination or multiscale hybrid frameworks. However, most of these hybrid models cannot easily cast a perfect reflection of erratic fluctuation in carbon trading schemes due to lack of judgment on the trend or inaccurate trend reconstruction. In this study, a novel filter-based modeling with Hodrick-Prescott (HP) filter, that can identify repeated up and down structural features around a certain carbon price, negotiates the obstacle of the parallel-series hybridization concerning the linear and the nonlinear model identification. The residual decomposition scheme with adaptive noise is carried out on the random and nonlinear component for error correction to filter-based models. Moreover, Bayesian optimization adjusts the structure of seven single-hidden layer feedforward neural networks (SLFNs) and the inputs to provide the best generalization performance. The proposed filter-hybrid model using kernel extreme learning machine as the final nonlinear integrator has better stability to the parameters, and has the superiority over the parallel-series and allocation-based models from a statistical perspective. Comparing with existing data-driven models, our proposed model is competitive in view of prediction accuracy and time cost in the majority of carbon futures trading cases.(C) 2022 Elsevier B.V. All rights reserved.",2022
