Article Title,Abstract,Publication Year
Pricing European Options with Deep Learning Models,"Applications of artificial neural networks for valuing financial options have a long history in academic research. When appropriately trained, these artificial neural networks have proved to obtain better results than traditional parametric models like Black-Scholes. This short paper intends to review the input variables and specific architecture of a multi-layer perceptron, long-short term memory and a convolutional neural network model for the purpose of pricing options. Additionally, it describes the data gathering process for the dataset that will be used to train these models.",2022
Time-sequencing European options and pricing with deep learning - Analyzing based on interpretable ALE method,"In this paper, we investigated the feasibility of pricing European options with time-sequencing data processing method and deep learning models, based on two European options, the ETF50 options of China and the S&P 500 options of America. Four competing models were built to verify the improvement of the 1D-CNN and LSTM models on the option pricing task. Methods like cross-validations and statistical tests were also used to make our experiments more robust. Besides, in order to increase the stability and the interpretability of our pricing models, we selected the ALE method to interpret and analyze the behavior of the deep learning models. The empirical results indicate that, in both ETF50 option and S&P500 option pricing tasks, the 1D-CNN and LSTM models had significant advantages in forecasting accuracy and robustness under moneyness, trading date or maturity dimension irrespectively. Especially for the LSTM model, which has robust performance using different kinds of cross-validation methods. With the help of ALE method, we proved that the improved performance brought by the 1D-CNN and LSTM models could be attributed to their capability of capturing time-series information and their different emphasis on input features and lags.",2022
Dual-Hybrid Modeling for Option Pricing of CSI 300ETF,"The reasonable pricing of options can effectively help investors avoid risks and obtain benefits, which plays a very important role in the stability of the financial market. The traditional single option pricing model often fails to meet the ideal expectations due to its limited conditions. Combining an economic model with a deep learning model to establish a hybrid model provides a new method to improve the prediction accuracy of the pricing model. This includes the usage of real historical data of about 10,000 sets of CSI 300 ETF options from January to December 2020 for experimental analysis. Aiming at the prediction problem of CSI 300ETF option pricing, based on the importance of random forest features, the Convolutional Neural Network and Long Short-Term Memory model (CNN-LSTM) in deep learning is combined with a typical stochastic volatility Heston model and stochastic interests CIR model in parameter models. The dual hybrid pricing model of the call option and the put option of CSI 300ETF is established. The dual-hybrid model and the reference model are integrated with ridge regression to further improve the forecasting effect. The results show that the dual-hybrid pricing model proposed in this paper has high accuracy, and the prediction accuracy is tens to hundreds of times higher than the reference model; moreover, MSE can be as low as 0.0003. The article provides an alternative method for the pricing of financial derivatives.",2022
Option Pricing Using LSTM: A Perspective of Realized Skewness,"Deep learning has drawn great attention in the financial field due to its powerful ability in nonlinear fitting, especially in the studies of asset pricing. In this paper, we proposed a long short-term memory option pricing model with realized skewness by fully considering the asymmetry of asset return in emerging markets. It was applied to price the ETF50 options of China. In order to emphasize the improvement of this model, a comparison with a parametric method, such as Black-Scholes (BS), and machine learning methods, such as support vector machine (SVM), random forests and recurrent neural network (RNN), was conducted. Moreover, we also took the characteristic of heavy tail into consideration and studied the effect of realized kurtosis on pricing to prove the robustness of the skewness. The empirical results indicate that realized skewness significantly improves the pricing performance of LSTM among moneyness states except for in-the-money call options. Specifically, the LSTM model with realized skewness outperforms the classical method and other machine learning methods in all metrics.",2023
Deep Learning Based Hybrid Computational Intelligence Models for Options Pricing,"Options are commonly used by traders and investors for hedging their investments. They also allow the traders to execute leveraged trading opportunities. Meanwhile accurately pricing the intended option is crucial to perform such tasks. The most common technique used in options pricing is Black-Scholes (BS) formula. However, there are slight differences between the BS model output and the actual options price due to the ambiguity in defining the volatility. In this study, we developed hybrid deep learning based options pricing models to achieve better pricing compared to BS. The results indicate that the proposed models can generate more accurate prices for all option classes. Compared with BS using annualized 20 intraday returns as volatility, 94.5% improvement is achieved in option pricing in terms of mean squared error.",2022
Bitcoin Options Pricing Using LSTM-based Prediction Model and Blockchain Statistics,"Although Bitcoin and other cryptocurrencies continue to attract attention, the inaccurate pricing of Bitcoin options has resulted in an inefficient cryptoderivative market. In this paper, we adopt a multiple input LSTM-based prediction model in conjunction with the Black-Scholes (BS) model to address this challenge in Bitcoin option pricing. We discuss the relationship between on/off-chain transactions and predict the implied price volatility of the next 30 days, which is the main factor in the BS model. First, we analyze the Blockchain statistics and social network trends of Bitcoin as inputs to our model, including the liveness of Blockchain wallet, the scale of active Blockchain nodes and the impact factor of Google, Reddit, Twitter to name a few. Next, we implement the LSTM-based prediction model and evaluate it in various historical window sizes and network parameters. Finally, we compare the performance with the baseline model without Blockchain statistics inputs. The experimental results show that the proposed multi-input LSTM-based prediction model provides the risk-informed pricing of the Bitcoin call options and our Blockchain statistics reduce the root-mean-square error (RMSE) by up to 46.2%.",2019
Option pricing with deep learning: a long short-term memory approach,"This paper presents a deep learning approach for option pricing using a long short-term memory (LSTM) neural network applied to European call options on the S&P 500 index. We utilize a rolling window approach that trains 12 instances of the LSTM model, one for each month of 2021. To gain further insight into the model performance, we use explainable artificial intelligence (XAI) through SHapley Additive Explanations (SHAP). We find that the LSTM model outperforms the Black-Scholes and the Heston models and a multilayer perceptron (MLP) neural network regarding overall pricing accuracy. Most notably, the time-sequencing nature of LSTM enables the proposed model to capture sufficient short-term volatility from recently traded options. This result is still robust when controlling for time-varying volatility dynamics. Thus, the model is less prone to measurement errors in volatility.",2025
Real options pricing based on BP neural networks and-GA,"This paper applies artificial neural networks on real options pricing. We discard redundant nodes and branches of neural networks through choosing variables by using genetic algorithms, so that the optimization on BP neural networks can be realized. In the process of pricing, we consider some factors that have influence on real options pricing and are neglected by existing pricing method, so the precision of evaluation can be improved to a certain extent, which is indicated by simulation results.",2004
A deep learning-based Monte Carlo algorithm with applications in American options pricing,"In this article, we introduce a deep learning-based Monte Carlo method and apply it to pricing high-dimensional American options. This method keeps track of the approximating optimal stopping time and evaluates it by independent samples at each time step. The consistency and convergence rate of the algorithm are derived, which show that this method is able to circumvent the curse of dimensionality. The numerical results show that our method is efficient and accurate in pricing high-dimensional American options.",2025
Pricing and Hedging American-Style Options with Deep Learning,"In this paper we introduce a deep learning method for pricing and hedging American-style options. It first computes a candidate optimal stopping policy. From there it derives a lower bound for the price. Then it calculates an upper bound, a point estimate and confidence intervals. Finally, it constructs an approximate dynamic hedging strategy. We test the approach on different specifications of a Bermudan max-call option. In all cases it produces highly accurate prices and dynamic hedging strategies with small replication errors.",2020
Enhancing Option Pricing Accuracy in the Indian Market: A CNN-BiLSTM Approach,"Due to overly optimistic economic and statistical assumptions, the classical option pricing model frequently falls short of ideal predictions. Rapid progress in artificial intelligence, the availability of massive datasets, and the rise in computational power in machines have all created an environment conducive to the development of complex methods for predicting financial derivatives prices. This study proposes a hybrid deep learning (DL) based predictive model for accurate and prompt prediction of option prices by fusing a one-dimensional convolutional neural network (CNN) and a bidirectional long short-term memory (BiLSTM). A set of 15 predictive factors is carefully built under the umbrella of fundamental market data and technical indicators. Our proposed model is compared with other DL-based models using six evaluation metrics-root mean square error (RMSE), mean absolute percentage error, mean percentage error, determination coefficient (R2\documentclass[12pt]{minimal} \usepackage{amsmath} \usepackage{wasysym} \usepackage{amsfonts} \usepackage{amssymb} \usepackage{amsbsy} \usepackage{mathrsfs} \usepackage{upgreek} \setlength{\oddsidemargin}{-69pt} \begin{document}$$R<^>2$$\end{document}), maximum error and median absolute error. Further, statistical analysis of models is also done using one-way ANOVA and posthoc analysis using the Tukey HSD test to demonstrate that the CNN-BiLSTM model outperforms competing models in terms of fit and prediction accuracy.",2024
A deep learning method for pricing high-dimensional American-style options via state-space partition,"This paper proposes a deep learning approach for solving optimal stopping problems and high-dimensional American-style options pricing problems. Through state-space partition, the method does not require recalculation of the structure of networks when the price of the asset changes, which makes tracking valuation more efficient. This paper also offers theoretical proof for the existence of a deep learning network that can determine the optimal stopping time via state-space partition. We present convergence proofs for the estimators and also test the method on Bermuda max-call options as examples.",2024
Evolutionary Hedging Model for Power Trading to Maximize Daily Profits,"Established trading strategies such as fully back-to-back hedging no longer work in a world where customers transfer the cost of hedging completely to traders. Dynamic daily hedging models, in which profits are generated from long and short futures' positions, have been proposed in combination with accurate Phelix futures and spot price forecasting. This study provides a new approach to accurately forecast Phelix monthly futures prices with long short-term memory-recurrent neural network time series. In addition, a newly proposed daily dynamic hedging model capable of processing recurring inputs is optimized with an evolutionary algorithm to maximize daily profits. Calculated optimized daily hedge ratios provided by the algorithm are backtested on real Phelix market data. The results for the different tested periods confirm that a trading company could consistently generate positive returns under the most competitive pricing assumption and outperform established trading strategies in both trending bear and bull markets.",2020
One Parameter Selection Method of the BP Neural Network on Real Options Pricing,"Based on the theory of BP neural network, the evaluation prediction model of real options pricing was established. Some quantized and non-quantized factors were all considered into the model such as evaluation value uncertainty, investment cost, investment opportunity duration, share degree, environment risk and so on. With one given example, the input parameters of the model were optimized by means of genetic algorithm and the detailed input parameters optimization process was also pointed out by dint of one calculation flow chart. The results show that the method not only guarantees the precision of calculation, but also reduces the number of input variables in the prediction model. At the same time, it can avoid that the calculation does not converge because of lots of input parameters to the prediction model. In addition, this can also reduce the subjectivity of the Black-Scholes model and make the evaluation of real options pricing more accurate. As a result, one good prediction effect has been obtained again.",2014
Multi-perspective option price forecasting combining parametric and non-parametric pricing models with a new dynamic ensemble framework,"This article introduces a dynamic ensemble framework that integrates parametric and non-parametric pricing models. Within this framework, we propose a time-varying parametric pricing model optimized using artificial intelligence algorithms. Additionally, we construct a non-parametric pricing model using a 2-dimensional convolutional neural network (2D-CNN) to capture the interactions among options, enhancing the existing nonparametric pricing model. Validation using China's SSE 50 ETF options trading data reveals several key findings: Firstly, the dynamic integration method proposed in this study not only improves prediction accuracy but also enhances stability. Secondly, previous parametric pricing models do not effectively utilize their pricing performance, while our proposed time-varying parametric pricing model significantly enhances accuracy. Lastly, the 2D-CNN model, which considers interactions among options trades, proves to be reasonable and effective, outperforming common non-parametric pricing models. The dynamic ensemble framework proposed in this study effectively combines the strengths of both parametric and non-parametric pricing models. This research serves as an important reference for risk managers, institutional investors, and other stakeholders. Furthermore, it provides valuable research ideas for future scholars in the field.",2024
"A Time-Varying, Feature- Rearranged Convolutional Neural Network for Option Pricing","The rigid assumptions underlying conventional parametric option-pricing models prevent them from accurately capturing the underlying nature of the market. Most of these models must be estimated numerically, because they cannot be solved analytically, which inevitably leads to estimation errors. Previous studies of option pricing, which have focused primarily on a single option variable, have not taken into account the effects of other options traded within the same time period. In order to address these issues, the authors use convolutional neural network (CNN) pattern recognition to fit the option panel data and provide a feature-rearrangement mechanism to account for the correlations between non-adjacent options. The suggested feature-rearranged CNN (FR-CNN) model is entirely data-driven without any preliminary assumptions. The authors' experiments with the Chinese SSE 50 ETF option show that the proposed FR-CNN outperformed the jump-diffusion model and CNN by 59.59% and 17.34%, respectively.",2024
Forecasting spot prices of agricultural commodities in India: Application of deep-learning models,"Food price fluctuations can impact both producers and consumers. Forecasting the prices of the agricultural commodities is of prime concern not only to the government but also to farmers and agribusiness firms. In developing countries like India, management of food security needs competent and efficient forecasting of food prices. With the availability of data, recent innovation in deep-learning models provides a feasible solution to accurately forecast the prices. In this study, we examine the superiority of these models using the daily spot prices of five major commodities traded on the National Commodity and Derivatives Exchange: cotton seed, castor seed, rape mustard seed, soybean seed, and guar seed. The results were obtained from the application of the traditional univariate autoregressive integrated moving average model and deep-learning techniques like the time-delay neural network (TDNN) and long short-term memory (LSTM) network. The empirical results indicate that the LSTM model is indeed suitable for the financial domain and captures the directional movement of the spot price changes with high accuracy compared with the TDNN and other linear models. Accuracy of the performance of these models has been compared using out-of-sample performance measure. The overall objective of this paper is to demonstrate the utility of spot price forecasting for farmers and traders in offering them the best predictions of the price movements. Our results provide a possibility of developing pricing models that can help in fairly regulating agricultural commodity prices.",2021
A CNN based system for predicting the implied volatility and option prices,"The evaluations of option prices and implied volatility are critical for option risk management and trading. Common strategies in existing studies relied on the parametric models. However, these models are based on several idealistic assumptions. In addition, previous research on option pricing mainly depends on the historical transaction records without considering the performance of other concurrent options. To address these challenges, we proposed a convolutional neural network (CNN) based system for predicting the implied volatility and the option prices. Specifically, the customized non-parametric learning approach is first used to estimate the implied volatility. Second, several traditional parametric models are also implemented to estimate these prices as well. The convolutional neural network is utilized to obtain the predictions based on the estimation of the implied volatility. Our experiments based on Chinese SSE 50 ETF options demonstrate that the proposed framework outperforms the traditional methods with at least 40.11% performance enhancement in terms of RMSE.",2020
Trend Forecast of Shanghai Crude Oil Futures,"The dominant position in crude oil pricing affects a country's energy and economic security. We construct different time-series forecasting models to analyze the long-term trends of Shanghai crude oil futures and guide current price trading. First, we built a classic ARIMA model as the benchmark. It is a good choice for short-term investors but does not apply to long-term trend prediction. We propose an improved HW-Prophet model that can maximize its advantages in selecting and reconstructing mutation points and reduce the forecast error by approximately 22%. The Prophet model is then introduced into the prediction of futures price series, and the Haar wavelet and KS (HWKS) algorithm and sliding window are used to optimize the change-point selection of the Prophet model. Finally, we created different combinations of long short-term memory (LSTM) and HW-Prophet models based on residual correction and optimal weighting. The results showed that the combined residual correction method was unsuitable for the two single models in this study. Because the residual sequence predicted by the HW-Prophet model is similar to white noise, it is difficult for LSTM to learn the effective dynamic laws from it. By minimizing the error sum of squares to solve the optimal weight coefficients and combining the two models linearly, the prediction advantages of a single model in different intervals can be effectively transmitted, and the prediction accuracy is greatly improved. The HW-Prophet-LSTM combination model constructed in this study based on the optimal weight is currently one of the best models for predicting the long-term trends of Shanghai crude oil futures.",2022
"Do Weather Derivatives Mitigate the Revenue Risk of Farmers?-The Case of Tongliao, Inner Mongolia, China","This research probes the potential of weather derivatives as tools for mitigating the variability of crop yields due to climatic uncertainties in China. Centered on Tongliao City in Inner Mongolia, the study exploits a long short-term memory (LSTM) network to dissect and simulate 32 years of local precipitation data, thereby achieving a simulation of high reliability. Further exploration through a multiple linear regression model confirms a marked positive relationship between rainfall amounts and maize yields. By combining precipitation put options and the total revenue function for farmers, mathematical derivations yield specific expressions for optimal trading quantities and risk hedging efficiency. The research findings show that, using an assumption of a maize price that is 3 CNY/kg, when farmers purchase around 6.22 precipitation put options they can achieve 67.9% risk hedging efficiency. This highlights the significant role of precipitation put options under specific conditions in reducing the risk of decreased maize yields due to reduced precipitation. However, in practical markets, variations in maize prices and the price change unit (lambda) are inevitable. Through further analysis, this study reveals that as these factors change, the optimal trading quantity and hedging efficiency also undergo varying degrees of adjustment. The investigation lays a theoretical groundwork for the practical application and empirical validation of weather derivatives within China's agrarian sector. However, the study underscores the necessity of a holistic approach to market dynamics to refine hedging strategies. Future decision making must integrate market fluctuations, and adopting transparent pricing mechanisms is critical for enhanced risk management and the advancement of sustainable agricultural practices.",2024
SF-Transformer: A Mutual Information-Enhanced Transformer Model with Spot-Forward Parity for Forecasting Long-Term Chinese Stock Index Futures Prices,"The complexity in stock index futures markets, influenced by the intricate interplay of human behavior, is characterized as nonlinearity and dynamism, contributing to significant uncertainty in long-term price forecasting. While machine learning models have demonstrated their efficacy in stock price forecasting, they rely solely on historical price data, which, given the inherent volatility and dynamic nature of financial markets, are insufficient to address the complexity and uncertainty in long-term forecasting due to the limited connection between historical and forecasting prices. This paper introduces a pioneering approach that integrates financial theory with advanced deep learning methods to enhance predictive accuracy and risk management in China's stock index futures market. The SF-Transformer model, combining spot-forward parity and the Transformer model, is proposed to improve forecasting accuracy across short and long-term horizons. Formulated upon the arbitrage-free futures pricing model, the spot-forward parity model offers variables such as stock index price, risk-free rate, and stock index dividend yield for forecasting. Our insight is that the mutual information generated by these variables has the potential to significantly reduce uncertainty in long-term forecasting. A case study on predicting major stock index futures prices in China demonstrates the superiority of the SF-Transformer model over models based on LSTM, MLP, and the stock index futures arbitrage-free pricing model, covering both short and long-term forecasting up to 28 days. Unlike existing machine learning models, the Transformer processes entire time series concurrently, leveraging its attention mechanism to discern intricate dependencies and capture long-range relationships, thereby offering a holistic understanding of time series data. An enhancement of mutual information is observed after introducing spot-forward parity in the forecasting. The variation of mutual information and ablation study results highlights the significant contributions of spot-forward parity, particularly to the long-term forecasting. Overall, these findings highlight the SF-Transformer model's efficacy in leveraging spot-forward parity for reducing uncertainty and advancing robust and comprehensive approaches in long-term stock index futures price forecasting.",2024
